id,category,abstract,year,cross_lists,cat_int
1105.3231,hep-th,"In 2008, Aharony, Bergman, Jafferis, and Maldacena (ABJM) discovered a three-dimensional Chern-Simons theory with N = 6 supersymmetry and conjectured that in a certain limit, this theory is dual to type IIA string theory on AdS4xCP3. Since then, a great deal of evidence has been accumulated which suggests that the ABJM theory is integrable in the planar limit. Integrability is a very useful property that allows many physical observables, such as anomalous dimensions and scattering amplitudes, to be computed efficiently. In the first half of this thesis, we will explain how to use integrabilty to compute the anomalous dimensions of long, single-trace operators in the ABJM theory. In particular, we will describe how to compute them at weak coupling using a Bethe Ansatz, and how to compute them at strong coupling using string theory. The latter approach involves using algebraic curve and world-sheet techniques to compute the energies of string states dual to gauge theory operators. In the second half of this thesis, we will discuss integrability from the point of view of on-shell scattering amplitudes in the ABJM theory. In particular, we will describe how to parameterize the amplitudes in terms of supertwistors and how to relate higher-point tree-level amplitudes to lower-point tree-level amplitudes using a recursion relation. We will also explain how this recursion relation can be used to show that all tree-level amplitudes of the ABJM theory are invariant under dual superconformal symmetry. This symmetry is hidden from the point of the action and implies that the theory has Yangian symmetry, which is a key feature of integrability. This thesis is mainly based on the material in [101], [83], and [84].",11,[],4
1103.3008,hep-th,"The MHV scattering amplitudes in planar N=4 SYM are dual to bosonic light-like Wilson loops. We explore various proposals for extending this duality to generic non-MHV amplitudes. The corresponding dual object should have the same symmetries as the scattering amplitudes and be invariant to all loops under the chiral half of the N=4 superconformal symmetry. We analyze the recently introduced supersymmetric extensions of the light-like Wilson loop (formulated in Minkowski space-time) and demonstrate that they have the required symmetry properties at the classical level only, up to terms proportional to field equations of motion. At the quantum level, due to the specific light-cone singularities of the Wilson loop, the equations of motion produce a nontrivial finite contribution which breaks some of the classical symmetries. As a result, the quantum corrections violate the chiral supersymmetry already at one loop, thus invalidating the conjectured duality between Wilson loops and non-MHV scattering amplitudes. We compute the corresponding anomaly to one loop and solve the supersymmetric Ward identity to find the complete expression for the rectangular Wilson loop at leading order in the coupling constant. We also demonstrate that this result is consistent with conformal Ward identities by independently evaluating corresponding one-loop conformal anomaly.",11,[],4
1103.1171,hep-th,"We study non-degenerate and degenerate (extremal) Killing horizons of arbitrary geometry and topology within the Einstein-Maxwell-dilaton model with a Liouville potential (the EMdL model) in d-dimensional (d>=4) static space-times. Using Israel's description of a static space-time, we construct the EMdL equations and the space-time curvature invariants: the Ricci scalar, the square of the Ricci tensor, and the Kretschmann scalar. Assuming that space-time metric functions and the model fields are real analytic functions in the vicinity of a space-time horizon, we study behavior of the space-time metric and the fields near the horizon and derive relations between the space-time curvature invariants calculated on the horizon and geometric invariants of the horizon surface. The derived relations generalize the similar relations known for horizons of static four and 5-dimensional vacuum and 4-dimensional electrovacuum space-times. Our analysis shows that all the extremal horizon surfaces are Einstein spaces. We present necessary conditions for existence of static extremal horizons within the EMdL model.",11,['gr-qc'],4
1109.3880,hep-th,Effective field theory of massive Yang-Mills fields interacting with fermions is considered. Perturbative renormalizability in the sense of effective field theory is shown. It is argued that the limit of vanishing vector boson mass leads to massless gauge effective field theory. Possible relevance for the solution to the strong CP problem is discussed.,11,['hep-ph'],4
1107.0663,hep-th,Nonstandard parafermions are built and their central charges and dimensions are calculated. We then construct new N=2 superconformal field theories by tensoring the parafermions with a free boson. We study the spectrum and modular transformations of these theories. Superstring and heterotic strings in four dimensions are then obtained by tensoring the new superconformal field theories along with some minimal models. The generations and antigenerations are studied. We give an example of the equation theory which is shown to have three net generations.,11,"['hep-ph', 'math-ph', 'math']",4
1110.4112,hep-th,"We examine Hamiltonian formalism on Euclidean Snyder space. The latter corresponds to a lattice in the quantum theory. For any given dynamical system, it may not be possible to identify time with a real number parametrizing the evolution in the quantum theory. The alternative requires the introduction of a dynamical time operator. We obtain the dynamical time operator for the relativistic (nonrelativistic) particle, and use it to construct the generators of Poincar\'e (Galilei) group on Snyder space.",11,"['math-ph', 'math']",4
1104.3135,hep-th,"Using the fact that every worldsheet is ruled by two (light-cone) copies of worldlines, the recent classification of off-shell supermultiplets of N-extended worldline supersymmetry is extended to construct standard off-shell and also unidextrous (on the half-shell) supermultiplets of worldsheet (p,q)-supersymmetry with no central extension. In the process, a new class of error-correcting (even-split doubly-even linear block) codes is introduced and classified for equation, providing a graphical method for classification of such codes and supermultiplets. This also classifies quotients by such codes, of which many are not tensor products of worldline factors. Also, supermultiplets that admit a complex structure are found to be depictable by graphs that have a hallmark twisted reflection symmetry.",11,[],4
1105.4706,hep-th,"Recently the Navier-Stokes equations have been derived from the duality with the black branes in AdS5. The zero modes of black branes are reinterpreted as dynamical degrees of freedom of a conformal fluid on the boundary of AdS5. Here, we derive the corrections to the Navier-Stokes equations due to fermionic zero modes of the black branes. We study only the contributions due to bilinears in the fermionic zero modes in the first order of the parameter expansion. The need of a superextension of the fluid dynamics is a consequence of the full AdS/CFT correspondence and yet to be investigated.",11,[],4
1103.1223,hep-th,"In this paper, we study the equations of motion for non-Abelian N=(2,0) tensor multiplets in six dimensions, which were recently proposed by Lambert and Papageorgakis. Some equations are regarded as constraint equations. We employ a loop extension of the Lorentzian three-algebra (3-algebra) and examine the equations of motion around various solutions of the constraint equations. The resultant equations take forms that allow Lagrangian descriptions. We find various (5d)-dimensional Lagrangians and investigate the relation between them from the viewpoint of M-theory duality.",11,[],4
1111.3373,hep-th,"We apply the Effective Field Theory of Inflation to study the case where the continuous shift symmetry of the Goldstone boson letter is softly broken to a discrete subgroup. This case includes and generalizes recently proposed String Theory inspired models of Inflation based on Axion Monodromy. The models we study have the property that the 2-point function oscillates as a function of the wavenumber, leading to oscillations in the CMB power spectrum. The non-linear realization of time diffeomorphisms induces some self-interactions for the Goldstone boson that lead to a peculiar non-Gaussianity whose shape oscillates as a function of the wavenumber. We find that in the regime of validity of the effective theory, the oscillatory signal contained in the n-point correlation functions, with n>2, is smaller than the one contained in the 2-point function, implying that the signature of oscillations, if ever detected, will be easier to find first in the 2-point function, and only then in the higher order correlation functions. Still the signal contained in higher-order correlation functions, that we study here in generality, could be detected at a subleading level, providing a very compelling consistency check for an approximate discrete shift symmetry being realized during inflation.",11,"['astro-ph', 'gr-qc', 'hep-ph']",4
1110.5855,hep-th,"Here we consider resonances of the Gauge, Gravity and Spinor fields in Randall-Sundrum-like scenarios. We consider membranes that are generated by a class of topological defects that are deformed domain walls obtained from other previously known ones. They are obtained by a deformation procedure generate different potentials to the associated Schrodinger-like equation. The resonance spectra are calculated numerically using the method of Transfer Matrix developed by the authors and presented in JHEP 1108 (2011) 071. The new deformed defects change the resonances spectra of all fields considered and the associated phenomenology as well.",11,"['cond-mat', 'hep-ph', 'quant-ph']",4
1101.3432,hep-th,"We provide a short review of the hydrodynamical properties of a class of strongly coupled thermal gauge theories, coupled to massless fundamental flavor fields, having a dual supergravity description. The analysis is valid for more general classes of nearly conformal holographic plasmas, where the breaking of conformality is driven by marginally (ir)relevant deformations.",11,"['hep-ph', 'nucl-th']",4
1105.4691,hep-th,In this paper we have considered the dynamics of an anomalous (equation) charged relativistic spinning particle in the presence of an external electromagnetic field. The constraint analysis is done and the complete set of Dirac brackets are provided that generate the canonical Lorentz algebra and dynamics through Hamiltonian equations of motion. The spin-induced effective curvature of spacetime and its possible connection with Analogue Gravity models are commented upon.,11,"['math-ph', 'math']",4
1112.1306,hep-th,"We analyse geometric type IIA flux compactifications leading to N=4 gauged supergravities in four dimensions. The complete landscape of isotropic vacua is presented, which turns out to belong to a unique theory. The solutions admit an uplift to maximal supergravity due to the vanishing of the flux-induced tadpoles for all the supersymmetry-breaking branes. Such an uplift is sketched out and the full N=8 mass spectra are discussed. We find the interesting presence of a non-supersymmetric and nevertheless stable minimum.",11,[],4
1106.1309,hep-th,"We review a recently proposed approach to construct superstring cosmological evolutions, which are free of Hagedorn instabilities and initial singularities. We illustrate these ideas in hybrid models in two dimensions.",11,"['gr-qc', 'hep-ph']",4
1104.2846,hep-th,"We consider the most general three point function for gravitational waves produced during a period of exactly de Sitter expansion. The de Sitter isometries constrain the possible shapes to only three: two preserving parity and one violating parity. These isometries imply that these correlation functions should be conformal invariant. One of the shapes is produced by the ordinary gravity action. The other shape is produced by a higher derivative correction and could be as large as the gravity contribution. The parity violating shape does not contribute to the bispectrum [1106.3228, 1108.0175], even though it is present in the wavefunction. We also introduce a spinor helicity formalism to describe de Sitter gravitational waves with circular polarization. These results also apply to correlation functions in Anti-de Sitter space. They also describe the general form of stress tensor correlation functions, in momentum space, in a three dimensional conformal field theory. Here all three shapes can arise, including the parity violating one.",11,['astro-ph'],4
1105.5616,hep-th,"If a system falls through a black hole horizon, then its information is lost to an observer at infinity. But we argue that the \it accessible information is lost \it before the horizon is crossed. The temperature of the hole limits information carrying signals from a system that has fallen too close to the horizon. Extremal holes have T=0, but there is a minimum energy required to emit a quantum in the short proper time left before the horizon is crossed. If we attempt to bring the system back to infinity for observation, then acceleration radiation destroys the information. All three considerations give a critical distance from the horizon equation, where equation is the horizon radius and equation is the energy scale characterizing the system. For systems in string theory where we pack information as densely as possible, this acceleration constraint is found to have a geometric interpretation. These estimates suggest that in theories of gravity we should measure information not as a quantity contained inside a given system, but in terms of how much of that information can be reliably accessed by another observer.",11,['gr-qc'],4
1104.2604,hep-th,"This is a comprehensive review of the worldsheet techniques for the quantization of type IIB superstring theory on the AdS5 x S5 background, using the pure spinor formalism. Particular emphasis is devoted to AdS/CFT applications, with several examples worked out in details. The review is self-contained and pedagogical. Table of contents: 1) Introduction; 2) Generalities; 3) Supercoset sigma models; 4) Quantum effective action and conformal invariance; 5) String spectrum; 6) Integrability.",11,[],4
1109.2579,hep-th,"A new method for the construction of conformally invariant equations in an arbitrary four dimensional (pseudo-) Riemannian space is presented. This method uses the Weyl geometry as a tool and exploits the natural conformal invariance we can build in the framework of this geometry. Indeed, working in a Weyl space, using the Weyl covariant derivative and the intrinsic Weylian geometrical tensors, all conformally homogeneous operators will be conformally invariant, as will the equations they determine. A Weyl space is defined by two independent objects: the metric tensor equation and the Weyl vector equation. A simple procedure allows us to go from a Weyl space into a Riemann space by imposing the Weyl vector to be a gradient. Under some conditions, the Weylian conformally invariant equations reduce to Riemannian conformally invariant equations. This method is applied to construct some conformally invariant scalar field equations, check the conformal invariance of Maxwell equations and recover the Eastwood-Singer conformal gauge fixing condition.",11,['gr-qc'],4
1108.1794,hep-th,"We use the resolution procedure of Esole and Yau arXiv:1107.0733 to study Yukawa couplings, G-flux, and the emergence of spectral covers from elliptically fibered Calabi-Yau's with a surface of A4 singularities. We provide a global description of the Esole-Yau resolution and use it to explicitly compute Chern classes of the resolved 4-fold, proving the conjecture of arXiv:0908.1784 for the Euler character in the process. We comment on the physical implications of the surprising singular fibers in codimension 2 and 3 in arXiv:1107.0733 and emphasize a group theoretic interpretation based on the A4 weight lattice. We then construct explicit G-fluxes by brute force in one of the 6 birationally equivalent Esole-Yau resolutions, quantize them explicitly using our result for the second Chern class, and compute the spectrum and flux-induced 3-brane charges, finding agreement with results and conjectures of local models in all cases. Finally, we provide a precise description of the spectral divisor formalism in this setting and sharpen the procedure described in arXiv:1107.1718 in order to explicitly demonstrate how the Higgs bundle spectral cover of the local model emerges from the resolved Calabi-Yau geometry. Along the way, we demonstrate explicitly how the quantization rules for fluxes in the local and global models are related.",11,[],4
1112.5342,hep-th,"Three-dimensional conformal field theories (CFTs) of deconfined gauge fields coupled to gapless flavors of fermionic and bosonic matter describe quantum critical points of condensed matter systems in two spatial dimensions. An important characteristic of these CFTs is the finite part of the entanglement entropy across a circle. The negative of this quantity is equal to the finite part of the free energy of the Euclidean CFT on the three-sphere, and it has been proposed to satisfy the so called F-theorem, which states that it decreases under RG flow and is stationary at RG fixed points. We calculate the three-sphere free energy of non-supersymmetric gauge theory with a large number NF of bosonic and/or fermionic flavors to the first subleading order in 1/NF. We also calculate the exact free energies of the analogous chiral and non-chiral \cal N = 2 supersymmetric theories using localization, and find agreement with the 1/NF expansion. We analyze some RG flows of supersymmetric theories, providing further evidence for the F-theorem.",11,"['cond-mat', 'quant-ph']",4
1107.5041,hep-th,"We construct a theory of fields living on continuous geometries with fractional Hausdorff and spectral dimensions, focussing on a flat background analogous to Minkowski spacetime. After reviewing the properties of fractional spaces with fixed dimension, presented in a companion paper, we generalize to a multi-fractional scenario inspired by multi-fractal geometry, where the dimension changes with the scale. This is related to the renormalization group properties of fractional field theories, illustrated by the example of a scalar field. Depending on the symmetries of the Lagrangian, one can define two models. In one of them, the effective dimension flows from 2 in the ultraviolet (UV) and geometry constrains the infrared limit to be four-dimensional. At the UV critical value, the model is rendered power-counting renormalizable. However, this is not the most fundamental regime. Compelling arguments of fractal geometry require an extension of the fractional action measure to complex order. In doing so, we obtain a hierarchy of scales characterizing different geometric regimes. At very small scales, discrete symmetries emerge and the notion of a continuous spacetime begins to blur, until one reaches a fundamental scale and an ultra-microscopic fractal structure. This fine hierarchy of geometries has implications for non-commutative theories and discrete quantum gravity. In the latter case, the present model can be viewed as a top-down realization of a quantum-discrete to classical-continuum transition.",11,"['gr-qc', 'math-ph', 'math']",4
1106.4015,hep-th,"The NSNS Lagrangian of ten-dimensional supergravity is rewritten via a change of field variables inspired by Generalized Complex Geometry. We obtain a new metric and dilaton, together with an antisymmetric bivector field which leads to a ten-dimensional version of the non-geometric Q-flux. Given the involved global aspects of non-geometric situations, we prescribe to use this new Lagrangian, whose associated action is well-defined in some examples investigated here. This allows us to perform a standard dimensional reduction and to recover the usual contribution of the Q-flux to the four-dimensional scalar potential. An extension of this work to include the R-flux is discussed. The paper also contains a brief review on non-geometry.",11,"['math-ph', 'math']",4
1107.2302,hep-th,We present a method for the analysis of singularities of Feynman amplitudes based on the Speer sector decomposition of the Schwinger parametric integrals combined with the Mellin-Barnes transform. The sector decomposition method is described in some details. We suggest the idea of applying the method to the analysis of collinear singularities in inclusive QCD cross sections in the mass-less limit regularizing the forward amplitudes by an off-shell choice of the initial particle momenta. It is shown how the suggested strategy works in the well known case of the one loop corrections to Deep Inelastic Scattering.,11,[],4
1111.6754,hep-th,We study the phi4 scalar field theory in de Sitter space using the 2PI effective action formalism. This formalism enables us to investigate the nonperturbative quantum effects. We use the mean field and gap equations and calculate the physical mass and effective potential. We find that nonperturbative infrared effects on de Sitter space produce a curvature-induced mass and work to restore the broken Z2 symmetry.,11,"['gr-qc', 'hep-ph']",4
1104.3852,hep-th,"Nonrelativistic quantum mechanics and conformal quantum mechanics are deformed through a Jordanian twist. The deformed space coordinates satisfy the Snyder noncommutativity. The resulting deformed Hamiltonians are pseudo-Hermitian Hamiltonians of the type discussed by Mostafazadeh. The quantization scheme makes use of the so-called ""unfolded formalism"" discussed in previous works. A Hopf algebra structure, compatible with the physical interpretation of the coproduct, is introduced for the Universal Enveloping Algebra of a suitably chosen dynamical Lie algebra (the Hamiltonian is contained among its generators). The multi-particle sector, uniquely determined by the deformed 2-particle Hamiltonian, is composed of bosonic particles.",11,"['math-ph', 'math']",4
1107.3967,hep-th,"These notes are based on lectures given by Michael Green during Part III of the Mathematics Tripos (the Certificate for Advanced Study in Mathematics) in the Spring of 2003. The course provided an introduction to string theory, focussing on the Bosonic string, but treating the superstring as well. A background in quantum field theory and general relativity is assumed. Some background in particle physics, group theory and conformal field theory is useful, though not essential. A number of appendices on more advanced topics are also provided, including an introduction to orientifolds in various brane configurations which helps to populate a relatively sparse part of the literature.",11,"['gr-qc', 'physics']",4
1104.4504,hep-th,"A recent precise formulation of the hoop conjecture in four spacetime dimensions is that the Birkhoff invariant equation (the least maximal length of any sweepout or foliation by circles) of an apparent horizon of energy equation and area equation should satisfy equation. This conjecture together with the Cosmic Censorship or Isoperimetric inequality implies that the length equation of the shortest non-trivial closed geodesic satisfies equation. We have tested these conjectures on the horizons of all four-charged rotating black hole solutions of ungauged supergravity theories and find that they always hold. They continue to hold in the the presence of a negative cosmological constant, and for multi-charged rotating solutions in gauged supergravity. Surprisingly, they also hold for the Ernst-Wild static black holes immersed in a magnetic field, which are asymptotic to the Melvin solution. In five spacetime dimensions we define equation as the least maximal area of all sweepouts of the horizon by two-dimensional tori, and find in all cases examined that equation, which we conjecture holds quiet generally for apparent horizons. In even spacetime dimensions equation, we find that for sweepouts by the product equation, equation is bounded from above by a certain dimension-dependent multiple of the energy equation. We also find that equation is bounded from above by a certain dimension-dependent multiple of the horizon area equation. Finally, we show that equation is bounded from above by a certain dimension-dependent multiple of the energy, for all Kerr-AdS black holes.",11,['gr-qc'],4
1109.6301,hep-th,"We consider the one loop effective action in four dimensional Euclidean space for a background chiral field coupled to a spinor field. It proves possible to find an exact expression for this action if the mass equation of the spinor vanishes. If equation does not vanish, one can make a perturbative expansion in powers of the axial field that contributes to the chiral field, while treating the contribution of the vector field exactly when it is a constant. The analogous problem in two dimensions is also discussed.",11,['hep-ph'],4
