id,category,abstract,year,cross_lists,cat_int
1206.5941,cs,"We introduce the cross-composition framework for proving kernelization lower bounds. A classical problem L AND/OR-cross-composes into a parameterized problem Q if it is possible to efficiently construct an instance of Q with polynomially bounded parameter value that expresses the logical AND or OR of a sequence of instances of L. Building on work by Bodlaender et al. (ICALP 2008) and using a result by Fortnow and Santhanam (STOC 2008) with a refinement by Dell and van Melkebeek (STOC 2010), we show that if an NP-hard problem OR-cross-composes into a parameterized problem Q then Q does not admit a polynomial kernel unless NP \subseteq coNP/poly and the polynomial hierarchy collapses. Similarly, an AND-cross-composition for Q rules out polynomial kernels for Q under Bodlaender et al.'s AND-distillation conjecture.   Our technique generalizes and strengthens the recent techniques of using composition algorithms and of transferring the lower bounds via polynomial parameter transformations. We show its applicability by proving kernelization lower bounds for a number of important graphs problems with structural (non-standard) parameterizations, e.g., Clique, Chromatic Number, Weighted Feedback Vertex Set, and Weighted Odd Cycle Transversal do not admit polynomial kernels with respect to the vertex cover number of the input graphs unless the polynomial hierarchy collapses, contrasting the fact that these problems are trivially fixed-parameter tractable for this parameter.   After learning of our results, several teams of authors have successfully applied the cross-composition framework to different parameterized problems. For completeness, our presentation of the framework includes several extensions based on this follow-up work. For example, we show how a relaxed version of OR-cross-compositions may be used to give lower bounds on the degree of the polynomial in the kernel size.",12,[],7
1203.2393,cs,"Accurate estimation of licensed channel Primary User's (PU) temporal statistics is important for Dynamic Spectrum Access (DSA) systems. With accurate estimation of the mean duty cycle, u, and the mean off- and on-times of PUs, DSA systems can more efficiently assign PU resources to its subscribers, thus, increasing channel utilization. This paper presents a mathematical analysis of the accuracy of estimating u, as well as the PU mean off- and on-times, where the estimation accuracy is expressed as the mean squared estimation error. The analysis applies for the traffic model assuming exponentially distributed PU off- and on-times, which is a common model in traffic literature. The estimation accuracy is quantified as a function of the number of samples and observation window length, hence, this work provides guidelines on traffic parameters estimation for both energy-constrained and delay-constrained applications. For estimating u, we consider uniform, non-uniform, and weighted sample stream averaging, as well as maximum likelihood estimation. The estimation accuracy of the mean PU off- and on-times is studied when maximum likelihood estimation is employed. Furthermore, we develop algorithms for the blind estimation of the traffic parameters based on the derived theoretical estimation accuracy expressions. We show that the estimation error for all traffic parameters is lower bounded for a fixed observation window length due to the correlation between the traffic samples. Moreover, we prove that for estimating u, maximum likelihood estimation can yield the same estimation error as weighted sample averaging using only half the observation window length.",12,[],7
1205.0314,cs,"Scribe notes from the 2012 Barbados Workshop on Computational Complexity. A series of lectures on Analysis of Boolean Functions by Ryan O'Donnell, with a guest lecture by Per Austrin.",12,[],7
1210.3719,cs,"In this work, we consider the long-standing open question of constructing constant-round concurrent zero-knowledge protocols in the plain model. Resolving this question is known to require non-black-box techniques.   We consider non-black-box techniques for zero-knowledge based on knowledge assumptions, a line of thinking initiated by the work of Hada and Tanaka (CRYPTO 1998). Prior to our work, it was not known whether knowledge assumptions could be used for achieving security in the concurrent setting, due to a number of significant limitations that we discuss here. Nevertheless, we obtain the following results:   1. We obtain the first constant round concurrent zero-knowledge argument for \textbfNP in the plain model based on a new variant of knowledge of exponent assumption. Furthermore, our construction avoids the inefficiency inherent in previous non-black-box techniques such that those of Barak (FOCS 2001); we obtain our result through an efficient protocol compiler.   2. Unlike Hada and Tanaka, we do not require a knowledge assumption to argue the soundness of our protocol. Instead, we use a discrete log like assumption, which we call Diffie-Hellman Logarithm Assumption, to prove the soundness of our protocol.   3. We give evidence that our new variant of knowledge of exponent assumption is in fact plausible. In particular, we show that our assumption holds in the generic group model.   4. Knowledge assumptions are especially delicate assumptions whose plausibility may be hard to gauge. We give a novel framework to express knowledge assumptions in a more flexible way, which may allow for formulation of plausible assumptions and exploration of their impact and application in cryptography.",12,[],7
1210.6891,cs,"In this work, we presented the strategies and techniques that we have developed for predicting the near-future churners and win-backs for a telecom company. On a large-scale and real-world database containing customer profiles and some transaction data from a telecom company, we first analyzed the data schema, developed feature computation strategies and then extracted a large set of relevant features that can be associated with the customer churning and returning behaviors. Our features include both the original driver factors as well as some derived features. We evaluated our features on the imbalance corrected dataset, i.e. under-sampled dataset and compare a large number of existing machine learning tools, especially decision tree-based classifiers, for predicting the churners and win-backs. In general, we find RandomForest and SimpleCart learning algorithms generally perform well and tend to provide us with highly competitive prediction performance. Among the top-15 driver factors that signal the churn behavior, we find that the service utilization, e.g. last two months' download and upload volume, last three months' average upload and download, and the payment related factors are the most indicative features for predicting if churn will happen soon. Such features can collectively tell discrepancies between the service plans, payments and the dynamically changing utilization needs of the customers. Our proposed features and their computational strategy exhibit reasonable precision performance to predict churn behavior in near future.",12,[],7
1211.4907,cs,"Mahotas is a computer vision library for Python. It contains traditional image processing functionality such as filtering and morphological operations as well as more modern computer vision functions for feature computation, including interest point detection and local descriptors.   The interface is in Python, a dynamic programming language, which is very appropriate for fast development, but the algorithms are implemented in C and are tuned for speed. The library is designed to fit in with the scientific software ecosystem in this language and can leverage the existing infrastructure developed in that language.   Mahotas is released under a liberal open source license (MIT License) and is available from (http://github.com/luispedro/mahotas) and from the Python Package Index (http://pypi.python.org/pypi/mahotas).",12,[],7
1204.1162,cs,"The Arabic language is a complex language; it is different from Western languages especially at the morphological and spelling variations. Indeed, the performance of information retrieval systems in the Arabic language is still a problem. For this reason, we are interested in studying the performance of the most famous search engine, which is a Google Desktop, while searching in Arabic language documents. Then, we propose an update to the Google Desktop to take into consideration in search the Arabic words that have the same root. After that, we evaluate the performance of the Google Desktop in this context. Also, we are interested in evaluation the performance of peer-to-peer application in two ways. The first one uses a simple indexation that indexes Arabic documents without taking in consideration the root of words. The second way takes in consideration the roots in the indexation of Arabic documents. This evaluation is done by using a corpus of ten thousand documents and one hundred different queries.",12,[],7
1203.0841,cs,"""How much c.e. sets could cover a given set?"" in this paper we are going to answer this question. Also, in this approach some old concepts come into a new arrangement. The major goal of this article is to introduce an appropriate definition for this purpose. Introduction In Computability Theory (Recursion Theory) in the first step we wish to recognize the sets which could be enumerated by Turing machines (equivalently, algorithms) and in the next step we will compare these sets by some reasonable order (Like Turing degree). Also sometimes with some extra information (Oracles) a class of non c.e. sets show the same behavior as c.e. sets (Post hierarchy and related theorems). Here we try another approach: ""Let A be an arbitrary set and we wish to recognize how much this set might be covered by a c.e. set?"" Although in some sense this approach could be seen in some definitions of Recursion Theory, but at the best of our knowledge it didn't considered as an approach yet, even though it is able to shed a light on some subjects of Computability of sets. Defining this approach is not quite straightforward and there are some obstacles to define them. To overcome these difficulties we modify the definitions. We have an alternative problem here when we consider recursive sets and not c.e. sets. In this case, the problem would be: ""Let A be an arbitrary set and we wish to know that how much this set might be covered by a recursive Set?"" Here, we try the first definition and the first problem.",12,[],7
1210.2972,cs,"We investigate the decidability and complexity status of model-checking problems on unlabelled reachability graphs of Petri nets by considering first-order and modal languages without labels on transitions or atomic propositions on markings. We consider several parameters to separate decidable problems from undecidable ones. Not only are we able to provide precise borders and a systematic analysis, but we also demonstrate the robustness of our proof techniques.",12,[],7
1205.6572,cs,"This paper proposes a Genetic Algorithm based segmentation method that can automatically segment gray-scale images. The proposed method mainly consists of spatial unsupervised grayscale image segmentation that divides an image into regions. The aim of this algorithm is to produce precise segmentation of images using intensity information along with neighborhood relationships. In this paper, Fuzzy Hopfield Neural Network (FHNN) clustering helps in generating the population of Genetic algorithm which there by automatically segments the image. This technique is a powerful method for image segmentation and works for both single and multiple-feature data with spatial information. Validity index has been utilized for introducing a robust technique for finding the optimum number of components in an image. Experimental results shown that the algorithm generates good quality segmented image.",12,[],7
1202.3706,cs,"At the heart of many scientific conferences is the problem of matching submitted papers to suitable reviewers. Arriving at a good assignment is a major and important challenge for any conference organizer. In this paper we propose a framework to optimize paper-to-reviewer assignments. Our framework uses suitability scores to measure pairwise affinity between papers and reviewers. We show how learning can be used to infer suitability scores from a small set of provided scores, thereby reducing the burden on reviewers and organizers. We frame the assignment problem as an integer program and propose several variations for the paper-to-reviewer matching domain. We also explore how learning and matching interact. Experiments on two conference data sets examine the performance of several learning methods as well as the effectiveness of the matching formulations.",12,[],7
1207.6630,cs,"A fundamental problem in the delay and backlog analysis across multi-hop paths in wireless networks is how to account for the random properties of the wireless channel. Since the usual statistical models for radio signals in a propagation environment do not lend themselves easily to a description of the available service rate on a wireless link, the performance analysis of wireless networks has resorted to higher-layer abstractions, e.g., using Markov chain models. In this work, we propose a network calculus that can incorporate common statistical models of fading channels and obtain statistical bounds on delay and backlog across multiple nodes. We conduct the analysis in a transfer domain, which we refer to as the `SNR domain', where the service process at a link is characterized by the instantaneous signal-to-noise ratio at the receiver. We discover that, in the transfer domain, the network model is governed by a dioid algebra, which we refer to as (min,x)-algebra. Using this algebra we derive the desired delay and backlog bounds. An application of the analysis is demonstrated for a simple multi-hop network with Rayleigh fading channels and for a network with cross traffic.",12,[],7
1208.4572,cs,"The CSA group at the University of Amsterdam has developed SVP, a framework to manage and program many-core and hardware multithreaded processors. In this article, we introduce the intermediate language SL, a common vehicle to program SVP platforms. SL is designed as an extension to the standard C language (ISO C99/C11). It includes primitive constructs to bulk create threads, bulk synchronize on termination of threads, and communicate using word-sized dataflow channels between threads. It is intended for use as target language for higher-level parallelizing compilers. SL is a research vehicle; as of this writing, it is the only interface language to program a main SVP platform, the new Microgrid chip architecture. This article provides an overview of the language, to complement a detailed specification available separately.",12,[],7
1203.0532,cs,"Classifying journals or publications into research areas is an essential element of many bibliometric analyses. Classification usually takes place at the level of journals, where the Web of Science subject categories are the most popular classification system. However, journal-level classification systems have two important limitations: They offer only a limited amount of detail, and they have difficulties with multidisciplinary journals. To avoid these limitations, we introduce a new methodology for constructing classification systems at the level of individual publications. In the proposed methodology, publications are clustered into research areas based on citation relations. The methodology is able to deal with very large numbers of publications. We present an application in which a classification system is produced that includes almost ten million publications. Based on an extensive analysis of this classification system, we discuss the strengths and the limitations of the proposed methodology. Important strengths are the transparency and relative simplicity of the methodology and its fairly modest computing and memory requirements. The main limitation of the methodology is its exclusive reliance on direct citation relations between publications. The accuracy of the methodology can probably be increased by also taking into account other types of relations, for instance based on bibliographic coupling.",12,[],7
1207.0405,cs,"We propose MITRA, a meta-model for the information flow in (computational) trust and reputation architectures. On an abstract level, MITRA describes the information flow as it is inherent in prominent trust and reputation models from the literature. We use MITRA to provide a structured comparison of these models. This makes it possible to get a clear overview of the complex research area. Furthermore, by doing so, we identify interesting new approaches for trust and reputation modeling that so far have not been investigated.",12,[],7
1208.2478,cs,"Recent work in commerce search has shown that understanding the semantics in user queries enables more effective query analysis and retrieval of relevant products. However, due to lack of sufficient domain knowledge, user queries often include terms that cannot be mapped directly to any product attribute. For example, a user looking for \tt designer handbags might start with such a query because she is not familiar with the manufacturers, the price ranges, and/or the material that gives a handbag designer appeal. Current commerce search engines treat terms such as \tt designer as keywords and attempt to match them to contents such as product reviews and product descriptions, often resulting in poor user experience.   In this study, we propose to address this problem by reformulating queries involving terms such as \tt designer, which we call \emphmodifiers, to queries that specify precise product attributes. We learn to rewrite the modifiers to attribute values by analyzing user behavior and leveraging structured data sources such as the product catalog that serves the queries. We first produce a probabilistic mapping between the modifiers and attribute values based on user behavioral data. These initial associations are then used to retrieve products from the catalog, over which we infer sets of attribute values that best describe the semantics of the modifiers. We evaluate the effectiveness of our approach based on a comprehensive Mechanical Turk study. We find that users agree with the attribute values selected by our approach in about 95% of the cases and they prefer the results surfaced for our reformulated queries to ones for the original queries in 87% of the time.",12,[],7
1211.2405,cs,"The rank of a bimatrix game (A,B) is the rank of the matrix AB. We give a construction of rank-1 games with exponentially many equilibria, which answers an open problem by Kannan and Theobald (2010).",12,[],7
1208.4877,cs,"Access control to data in traditional enterprises is typically enforced through reference monitors. However, as more and more enterprise data is outsourced, trusting third party storage servers is getting challenging. As a result, cryptography, specifically Attribute-based encryption (ABE) is getting popular for its expressiveness. The challenge of ABE is revocation.   To address this challenge, we propose PIRATTE, an architecture that supports fine-grained access control policies and dynamic group membership. PIRATTE is built using attribute-based encryption; a key and novel feature of our architecture, however, is that it is possible to remove access from a user without issuing new keys to other users or re-encrypting existing ciphertexts. We achieve this by introducing a proxy that participates in the decryption process and enforces revocation constraints. The proxy is minimally trusted and cannot decrypt ciphertexts or provide access to previously revoked users. We describe the PIRATTE construction and provide a security analysis along with performance evaluation.We also describe an architecture for online social network that can use PIRATTE, and prototype application of PIRATTE on Facebook.",12,[],7
1209.4560,cs,"We take an existing implementation of an algorithm for the maximum clique problem and modify it so that we can distribute it over an ad-hoc cluster of machines. Our goal was to achieve a significant speedup in performance with minimal development effort, i.e. a maximum costup. We present a simple modification to a state-of-the-art exact algorithm for maximum clique that allows us to distribute it across many machines. An empirical study over large hard benchmarks shows that speedups of an order of magnitude are routine for 25 or more machines.",12,[],7
1204.2718,cs,"Novel research in the field of Linked Data focuses on the problem of entity summarization. This field addresses the problem of ranking features according to their importance for the task of identifying a particular entity. Next to a more human friendly presentation, these summarizations can play a central role for semantic search engines and semantic recommender systems. In current approaches, it has been tried to apply entity summarization based on patterns that are inherent to the regarded data.   The proposed approach of this paper focuses on the movie domain. It utilizes usage data in order to support measuring the similarity between movie entities. Using this similarity it is possible to determine the k-nearest neighbors of an entity. This leads to the idea that features that entities share with their nearest neighbors can be considered as significant or important for these entities. Additionally, we introduce a downgrading factor (similar to TF-IDF) in order to overcome the high number of commonly occurring features. We exemplify the approach based on a movie-ratings dataset that has been linked to Freebase entities.",12,[],7
1206.6426,cs,"In spite of their superior performance, neural probabilistic language models (NPLMs) remain far less widely used than n-gram models due to their notoriously long training times, which are measured in weeks even for moderately-sized datasets. Training NPLMs is computationally expensive because they are explicitly normalized, which leads to having to consider all words in the vocabulary when computing the log-likelihood gradients.   We propose a fast and simple algorithm for training NPLMs based on noise-contrastive estimation, a newly introduced procedure for estimating unnormalized continuous distributions. We investigate the behaviour of the algorithm on the Penn Treebank corpus and show that it reduces the training times by more than an order of magnitude without affecting the quality of the resulting models. The algorithm is also more efficient and much more stable than importance sampling because it requires far fewer noise samples to perform well.   We demonstrate the scalability of the proposed approach by training several neural language models on a 47M-word corpus with a 80K-word vocabulary, obtaining state-of-the-art results on the Microsoft Research Sentence Completion Challenge dataset.",12,[],7
1211.6887,cs,"In this paper, I describe several approaches to automatic or semi-automatic development of symbolic rules for grammar checkers from the information contained in corpora. The rules obtained this way are an important addition to manually-created rules that seem to dominate in rule-based checkers. However, the manual process of creation of rules is costly, time-consuming and error-prone. It seems therefore advisable to use machine-learning algorithms to create the rules automatically or semi-automatically. The results obtained seem to corroborate my initial hypothesis that symbolic machine learning algorithms can be useful for acquiring new rules for grammar checking. It turns out, however, that for practical uses, error corpora cannot be the sole source of information used in grammar checking. I suggest therefore that only by using different approaches, grammar-checkers, or more generally, computer-aided proofreading tools, will be able to cover most frequent and severe mistakes and avoid false alarms that seem to distract users.",12,[],7
1203.0088,cs,"There is a vast supply of prior art that study models for mental processes. Some studies in psychology and philosophy approach it from an inner perspective in terms of experiences and percepts. Others such as neurobiology or connectionist-machines approach it externally by viewing the mind as complex circuit of neurons where each neuron is a primitive binary circuit. In this paper, we also model the mind as a place where a circuit grows, starting as a collection of primitive components at birth and then builds up incrementally in a bottom up fashion. A new node is formed by a simple composition of prior nodes when we undergo a repeated experience that can be described by that composition. Unlike neural networks, however, these circuits take ""concepts"" or ""percepts"" as inputs and outputs. Thus the growing circuits can be likened to a growing collection of lambda expressions that are built on top of one another in an attempt to compress the sensory input as a heuristic to bound its Kolmogorov Complexity.",12,[],7
1210.1757,cs,"We consider a simple simultaneous first price auction for multiple items in a complete information setting. Our goal is to completely characterize the mixed equilibria in this setting, for a simple, yet highly interesting, \tt AND-\tt OR game, where one agent is single minded and the other is unit demand.",12,[],7
