id,category,abstract,year,cross_lists,cat_int
1610.02907,physics,"In view of new experimental data the instability against adiabatic nonaxisymmetric perturbations of a Taylor-Couette flow with an axial density stratification is considered in dependence of the Reynolds number Re of rotation and the Brunt-Vaisala number Rn of the stratification. The flows at and beyond the Rayleigh limit become unstable between a lower and an upper Reynolds number (for fixed Rn). The rotation can thus be too slow or too fast for the stratorotational instability. The upper Reynolds number above which the instability decays, has its maximum value for the potential flow (driven by cylinders rotating according to the Rayleigh limit) and decreases strongly for flatter rotation profiles finally leaving only isolated islands of instability in the (Rn/Re) map. The maximal possible rotation ratio equation only slightly exceeds the shear value of the quasi-uniform flow with equationconst.   Along and between the lines of neutral stability the wave numbers of the instability patterns for all rotation laws beyond the Rayleigh limit are mainly determined by the Froude number Fr which is defined by the ratio between Re and Rn. The cells are highly prolate for Fr>1 so that measurements for too high Reynolds numbers become difficult for axially bounded containers. The instability patterns migrate azimuthally slightly faster than the outer cylinder rotates.",16,[],5
1608.05646,physics,"Here we obtain analytical expressions for the frequency response of a cantilever beam in the presence of ambient fluid. The advantage of our approach, besides its simplicity of use, is that it explicitly contains the viscosity and the density of the ambient fluid. Thus, if measuring the frequency spectrum, the expression can be used in the design of viscometers. Conversely, if the ambient fluid is known, the expression can be used in the design of force gauges such as in Atomic Force Microscopy.",16,[],5
1606.03291,physics,"Reliable and validated assessments of introductory physics have been instrumental in driving curricular and pedagogical reforms that lead to improved student learning. As part of an effort to systematically improve our sophomore-level Classical Mechanics and Math Methods course (CM 1) at CU Boulder, we have developed a tool to assess student learning of CM 1 concepts in the upper-division. The Colorado Classical Mechanics/Math Methods Instrument (CCMI) builds on faculty consensus learning goals and systematic observations of student difficulties. The result is a 9-question open-ended post-test that probes student learning in the first half of a two-semester classical mechanics / math methods sequence. In this paper, we describe the design and development of this instrument, its validation, and measurements made in classes at CU Boulder and elsewhere.",16,[],5
1601.06984,physics,"A sparse octree based parallel implementation of the lattice Boltzmann method for non-uniform meshes is presented in this paper. To couple grids of different resolutions, a second order accurate compact interpolation is employed and further extended into three dimensions. This compact interpolation requires only four source elements from the adjacent level for both two- and three dimensions. Thus, it reduces the computational and communication overhead in parallel executions. Moreover, the implementation of a weight based domain decomposition algorithm and level-wise elements arrangement are explained in details. The second order convergence of both velocity and strain rate are validated numerically in the Taylor-Green vortex test case. Additionally, the laminar flow around a cylinder at Re = 20, 100 and around a sphere at Re = 100 is investigated. Good agreement between simulated results and those from literature is observed, which provides further evidence for the accuracy of our method.",16,[],5
1612.06712,physics,"A description of the motion in noninertial reference frames by means of the inclusion of high time derivatives is studied. Incompleteness of the description of physical reality is a problem of any theory, both in quantum mechanics and classical physics. The 'stability principle' is put forward. We~also provide macroscopic examples of noninertial mechanics and verify the use of high-order derivatives as nonlocal hidden variables on the basis of the equivalence principle when acceleration is equal to the gravitational field. Acceleration in this case is a function of high derivatives with respect to time. The~definition of dark metrics for matter and energy is presented to replace the standard notions of dark matter and dark energy. In the Conclusion section, problem symmetry is noted for noninertial mechanics.",16,[],5
1610.09557,physics,"The purpose of this paper is to extend the recent work of Paul & Bandyopadhyay [Astrophys. Space Sci. 361, 172(2016)] on the existence of different dust ion acoustic solitary structures in an unmagnetized collisionless dusty plasma consisting of negatively charged static dust grains, adiabatic warm ions, nonthermal electrons and isothermal positrons in a more generalized form by considering nonthermal positrons instead of isothermal positrons. The present system supports both positive and negative potential double layers, coexistence of solitary waves of both polarities and positive potential supersolitons. The qualitative and the quantitative changes in existence domains of different solitary structures which occur for the presence of nonthermal positrons have been presented in comparison with the results of Paul & Bandyopadhyay [Astrophys. Space Sci. 361, 172(2016)]. The formation of supersoliton structures and their limitations have been analyzed with the help of phase portraits of the dynamical system corresponding to the dust ion acoustic solitary structures. Phase portrait analysis clearly indicates a smooth transition between soliton and supersoliton.",16,[],5
1606.03065,physics,"In this paper, we analyze the effect of different underground materials on very-low and low frequency magnetic fields used in the contexts of magneto-inductive localization and communication applications, respectively. We calculate the attenuation that these magnetic fields are subject to while passing through most common rocks and minerals. Knowing the attenuation properties is crucial in the design of underground magneto-inductive communication systems. In addition, we provide means to predict the distortions in the magnetic field that impair localization systems. The proposed work offers basic design guidelines for communication and localization systems in terms of channel path-loss, operation frequencies and bandwidth. For the sake of the reproducibility of the results, we provide the raw data and processing source code to be used by the two research communities.",16,[],5
1611.01430,physics,"We report on the realization of an ultracold (<25~muK) mixture of rubidium (87Rb) and metastable triplet helium (4He) in an optical dipole trap. Our scheme involves laser cooling in a dual-species magneto-optical trap, simultaneous MW- and RF-induced forced evaporative cooling in a quadrupole magnetic trap, and transfer to a single-beam optical dipole trap. We observe long trapping lifetimes for the doubly spin-stretched spin-state mixture and measure much shorter lifetimes for other spin-state combinations. We discuss prospects for realizing quantum degenerate mixtures of alkali-metal and metastable helium atoms.",16,[],5
1602.08578,physics,"The spatial development of hadronic showers in the CALICE scintillator-steel analogue hadron calorimeter is studied using test beam data collected at CERN and FNAL for single positive pions and protons with initial momenta in the range from 10 to 80 GeV/c. Both longitudinal and radial development of hadron showers are parametrised with two-component functions. The parametrisation is fit to test beam data and simulations using the QGSPBERT and FTFPBERT physics lists from Geant4 version 9.6. The parameters extracted from data and simulated samples are compared for the two types of hadrons. The response to pions and the ratio of the non-electromagnetic to the electromagnetic calorimeter response, h/e, are estimated using the extrapolation and decomposition of the longitudinal profiles.",16,[],5
1608.06150,physics,"A new concept of nonlinear focusing of colliding bunches, called Crab Waist (CW)collision scheme, has been proposed at LNF INFN. It has been successfully tested at the Italian lepton collider DAFNE in operational conditions providing luminosity for two different experimental detectors, SIDDHARTA and KLOE-2. Considering a high efficiency of the scheme for increasing collision luminosity and its relative simplicity for implementation several new collider projects have been proposed and are under development at present. These are the SuperKEKB B-factory ready to start commissioning in 2016 in Japan, the SuperC-Tau factory proposed in Novosibirsk and entered in the short list of Russian mega-science projects, the new 100-km electron-positron Future Circular Collider (FCC-ee) under design study at CERN and some others. In this paper we describe the CW collision scheme, discuss its advantages and report principal results achieved at the electron-positron Phi-factory DAFNE.",16,[],5
1611.08353,physics,"Confluent populations of elongated cells give rise to ordered patterns seen in nematic phase liquid crystals. We correlate cell elongation and intercellular distance with intercellular alignment using an amorphous spin glass model. We compare in vitro time-lapse imaging with Monte Carlo simulation results by framing a novel hard ellipses model in terms of Boltzmann statistics. Furthermore, we find a statistically distinct alignment energy at quasi-steady state among fibroblasts, smooth muscle cells, and pluripotent cell populations when cultured in vitro. These findings have important implications in both non-invasive clinical screening of the stem cell differentiation process and in relating shape parameters to coupling in active crystal systems such as nematic cell monolayers.",16,[],5
1607.08528,physics,"A study of ice formation in stationary turbulent conditions is carried out in various limit regimes of crystal growth, supercooling and ice entrainment at the water surface. Analytical expressions for the temperature, salinity and ice concentration mean profiles are provided, and the role of fluctuations in ice production is numerically quantified. Lower bounds on the ratio of sensible heat flux to latent heat flux to the atmosphere are derived and their dependence on key parameters such as salt restitution in freezing and ice entrainment in the water column is elucidated.",16,[],5
1604.00767,physics,"The role of ion polarisation and finite Larmor radius on the isotope effect on turbulent tokamak edge transport and flows is investigated by means of local electromagnetic multi-species gyro-fluid computations. Transport is found to be reduced with the effective plasma mass for protium, deuterium and tritium mixtures. This isotope effect is found for both cold and warm ion models, but significant influence of finite Larmor radius and polarisation effects are identified. Sheared flow reduction of transport through self generated turbulent zonal flows and geodesic acoustic modes in the present model (not including neoclassical flows) is found to play only a minor role on regulating isotopically improved confinement.",16,[],5
1604.02326,physics,"The SEHRS and SERS spactra of 4,4 - Bipyridine are analyzed on the base of the Dipole-Quadrupole theory for two possible geometries of the molecule. It is demonstrated that there appear strong lines caused by vibrations transforming after a unit irreducible representation both for the geometry with D2 and D2h symmetry groups, which may probably describe the symmetry properties of the molecule. Appearance of these lines is associated with a strong quadrupole light-molecule interaction, which arises in nano size rregions of sharp roughness of the metal. In addition, there are the lines caused by contributions from both the vibrations transforming after the unit irredicible representations A or Ag and the representations B1 or B1u, respectively, which describe transformational properties of the Ez component of the dipole moment, which is perpendicular to the surface for both geometries. This result is associated with a specific geometry of the molecule, when the indicated vibrations can be nearly degenerated and can not be resolved by the SEHRS and SERS spectra analysis. This issue is in a full compliance with the results of the SEHRS and SERS Dipole-Quadrupole theory.",16,[],5
1602.04086,physics,"We introduce a rigorous and simple method for analyzing metasurfaces, modeled as zero-thickness electromagnetic sheets, in Finite Difference (FD) techniques. The method consists in describing the spatial discontinuity induced by the metasurface as a virtual structure, located between nodal rows of the Yee grid, using a finite difference version of Generalized Sheet Transition Conditions (GSTCs). In contrast to previously reported approaches, the proposed method can handle sheets exhibiting both electric and magnetic discontinuities, and represents therefore a fundamental contribution in computational electromagnetics. It is presented here in the framework of the FD Frequency Domain (FDFD) method but also applies to the FD Time Domain (FDTD) scheme. The theory is supported by five illustrative examples.",16,[],5
1611.00324,physics,"equation(equation), of the HequationequationO molecule is reported for temperatures between 0 and 6000 K. Determination of equation(equation) is principally based on the direct summation technique involving all accurate experimental energy levels known for HequationequationO (almost 20~000 rovibrational energies including an almost complete list up to a relative energy of 7500 \cm), augmented with a less accurate but complete list of first-principles computed rovibrational energy levels up to the first dissociation limit, about 41~000 \cm\ (the latter list includes close to one million bound rovibrational energy levels up to equation, where equation is the rotational quantum number). Partition functions are developed for \it ortho- and \it para-HequationequationO as well as for their equilibrium mixture. Unbound rovibrational states above the first dissociation limit are considered using an approximate model treatment. The effect of the excited electronic states on the thermochemical functions is neglected, as their contribution to the thermochemical functions is negligible even at the highest temperatures considered. Based on the high-accuracy equation(equation) and its first two moments, definitive results, in 1~K increments, are obtained for the following thermochemical functions: Gibbs energy, standardized enthalpy, entropy, and isobaric heat capacity. Reliable approximately two standard deviation uncertainties, as a function of temperature, are estimated for each quantity determined. These uncertainties emphasize that the present results are the most accurate ideal-gas thermochemical functions ever produced for HequationequationO. It is recommended that the new value determined for the standard molar enthalpy increment at 298.15~K, equation kJ~molequation, should replace the old CODATA datum, equation kJ~molequation.",16,[],5
1601.04524,physics,"The paper aims to consider the electromagnetic adjoint-field in the complex octonion space as the dark matter field, describing some properties of dark matter, especially the origin, particle category, existence region, and force and so forth. Since J. C. Maxwell applied the algebra of quaternions to depict the electromagnetic theory, some scholars adopt the complex quaternion and octonion to study the physics property of electromagnetic and gravitational fields. In the paper, by means of the octonion operator, it is found that the gravitational field accompanies with one adjoint-field, which property is partly similar to that of electromagnetic field. And the electromagnetic field accompanies with another adjoint-field, which feature is partly similar to that of gravitational field. As a result the electromagnetic adjoint-field is able to be chosen as one candidate of the dark matter field. According to the electromagnetic adjoint-field, it is able to predict a few properties of dark matter, for instance, the particle category, interaction intensity, interaction distance, and existence region and so forth. The study reveals that the dark matter particle and gravitational resource both will be influenced by the gravitational strength and force. The dark matter field is capable of making a contribution to physics quantities of gravitational field, including the angular momentum, torque, energy, and force and so on. Further there may be comparatively more chances to discover the dark matter in some regions with the ultrastrong field strength, surrounding the neutral star, white dwarf, galactic nucleus, black hole, and astrophysical jet and so on.",16,[],5
1603.03572,physics,"The effect of magnetic perturbations (MPs) on the helical self-organization of shaped tokamak plasmas is discussed in the framework of the nonlinear 3D MHD model. Numerical simulations performed in toroidal geometry with the \textscpixie3d code [L. Chac\'on, Phys. Plasmas \bf 15, 056103 (2008)] show that equation MPs significantly affect the spontaneous quasi-periodic sawtoothing activity of such plasmas. In particular, the mitigation of sawtooth oscillations is induced by equation and equation MPs. These numerical findings provide a confirmation of previous circular tokamak simulations, and are in agreement with tokamak experiments in the RFX-mod and DIII-D devices. Sawtooth mitigation via MPs has also been observed in reversed-field pinch simulations and experiments. The effect of MPs on the stochastization of the edge magnetic field is also discussed.",16,[],5
1606.00691,physics,"The modified dynamical equation of motions introduced in previous publication topological torsion current (TTC) [Mario J. Pinheiro (2013) 'A Variational Method in Out-of-Equilibrium Physical Systems', Scientific Reports \bf 3, Article number: 3454] predicts a so-far unforeseen anomalous acceleration detected in spacecrafts during close planetary flybys in retrograde direction, and a null-effect when the spacecraft approach the planet in posigrade direction.",16,[],5
1603.00817,physics,"As we age, our hearts undergo changes which result in reduction in complexity of physiological interactions between different control mechanisms. This results in a potential risk of cardiovascular diseases which are the number one cause of death globally. Since cardiac signals are nonstationary and nonlinear in nature, complexity measures are better suited to handle such data. In this study, non-invasive methods for detection of cardiac aging using complexity measures are explored. Lempel-Ziv (LZ) complexity, Approximate Entropy (ApEn) and Effort-to-Compress (ETC) measures are used to differentiate between healthy young and old subjects using heartbeat interval data. We show that both LZ and ETC complexity measures are able to differentiate between young and old subjects with only 10 data samples while ApEn requires at least 15 data samples.",16,[],5
1601.02874,physics,"Large ring-laser gyroscopes are capable of measuring angular rotations with a precision well below fractions of equation, not far from equation equation, the accuracy required for General Relativity tests, this is what the GINGER (Gyroscope-IN-GEneral-Relativity) experiment is aiming for. These features do not guarantee the possibility of measuring the General Relativity Lense--Thirring effect, that manifests itself as a tiny (equation) perturbation of the Earth rotation rate. An underground location being in principle less affected by external local disturbances represents a good candidate for housing such a challenging experiment. GINGERino is a test apparatus to investigate the residual local disturbances in the most inner part of the underground international laboratory of the GranSasso (LNGS). It consists of a square ring laser with a equation m side. The instrument has been tailored to be the larger allowed by the particular location inside the laboratory. Its main objective is to measure the very low frequency rotational motions, in order to prove that LNGS is a suitable location for very low noise measurements and, possibly, General Relativity tests. Aside this main goal, GINGERino will provide unique data for geodesy and geophysics. Its installation has been completed during 2015. Since then, several long set of data have been collected, and the apparatus has been continuously running unattended for more than one week. The typical power spectrum sensitivity was a few equation, with integration time not longer than tens of seconds. Improvements of the apparatus are ongoing in order to improve the integration time.",16,[],5
1603.03412,physics,"We report on a compact, tunable, and scalable to large arrays imaging device, based on a radio-frequency optically pumped atomic magnetometer operating in magnetic induction tomography modality. Imaging of conductive objects is performed at room temperature, in an unshielded environment and without background subtraction. Conductivity maps of target objects exhibit not only excellent performance in terms of shape reconstruction but also demonstrate detection of sub-millimetric cracks and penetration of conductive barriers. The results presented here demonstrate the potential of a future generation of imaging instruments, which combine magnetic induction tomography and the unmatched performance of atomic magnetometers.",16,[],5
1601.05888,physics,"We report on the first micro-scale observation of the velocity field imposed by a non-uniform heat content along the solid/liquid boundary. We determine both radial and vertical velocity components of this thermo-osmotic flow field by tracking single tracer nanoparticles. The measured flow profiles are compared to an approximate analytical theory and to numerical calculations. From the measured slip velocity we deduce the thermo-osmotic coefficient for both bare glass and Pluronic F-127 covered surfaces. The value for Pluronic F-127 agrees well with Soret data for polyethylene glycol, whereas that for glass differs from literature values and indicates the complex boundary layer thermodynamics of glass-water interfaces.",16,[],5
1611.04304,physics,"We consider the interaction of atomic hydrogen with an intense laser field within the strong-field approximation. By using a Faddeev-like formalism, we introduce a new perturbative series in the binding potential of the atom. As a first test of this new approach, we calculate the electron energy spectrum in the very simple case of a photon energy higher than the ionisation potential. We show that by contrast to the standard perturbative series in the binding potential obtained within the strong field approximation, the first terms of the new series converge rapidly towards the results we get by solving the corresponding time-dependent Schroedinger equation.",16,[],5
1609.02642,physics,"This paper reports X-ray microtomographic visualization of the microorganism Escherichia coli overexpressing a metalloprotein ferritin. The three-dimensional distribution of linear absorption coefficients determined using a synchrotron radiation microtomograph with a simple projection geometry revealed that the X-ray absorption was homogeneously distributed, suggesting that every E. coli cell was labeled with the ferritin. The ferritin-expressing E. coli exhibited linear absorption coefficients comparable to those of phosphotungstic-acid stained cells. The submicrometer structure of the ferritin-expressing E. coli cells was visualized by Zernike phase contrast using an imaging microtomograph equipped with a Fresnel zone plate. The obtained images revealed curved columnar or bunching oval structures corresponding to the E. coli cells. These results indicate that the metalloprotein overexpression facilitates X-ray visualization of three-dimensional cellular structures of biological objects.",16,[],5
1609.07513,physics,"Following the recent developement of Fourier ptychographic microscopy (FPM) in the visible range by Zheng et al. (2013), we propose an adaptation for hard x-rays. FPM employs ptychographic reconstruction to merge a series of low-resolution, wide field of view images into a high-resolution image. In the x-ray range this opens the possibility to overcome the limited numerical aperture of existing x-ray lenses. Furthermore, digital wave front correction (DWC) may be used to charaterize and correct lens imperfections. Given the diffraction limit achievable with x-ray lenses (below 100 nm), x-ray Fourier ptychographic microscopy (XFPM) should be able to reach resolutions in the 10 nm range.",16,[],5
