id,category,abstract,year,cross_lists,cat_int
1212.2627,physics,"In this paper we show that the simple analysis of the local geomagnetic field behaviour can serve as reliable imminent precursor for regional seismic activity increasing. As the first step the problem was investigated using one- component Dubna fluxgate magnetometer. The result of 2001-2004 Sofia monitoring confirmed many old papers for connection between Earth tide (Sun- Moon tides as earthquakes trigger) and jump (Geomagnetic quake) of daily averaged one minute standart deviation of the geomagnetic field. The second step (2004-present), which included analisys of three-component Danish fluxgate magnetometer data, worked in Skopje Seismological observatory, confirmed the first step result. The analysis of INTERMAGNET data stations around which was happened stronger earthquakes also confirmed our result. The distribution of time difference between the times of such earthquakes and local daily averaged tide vector movement for impending tide extreme confirms our estimate that the increasing seismicity is realized in time window about /- 2.7 days. The Complex program for researching the possibility for when, where and how earthquakes prediction is proposed as well as the short description of FORTRAN codes for analysis of earthquakes, geomagnetic and tide data, their correlations and visualization.",12,[],5
1204.0925,physics,"In this work, we have considered equation-dimensional Einstein field equations in which 4-dimensional space-time which is described by a FRW metric and that of the extra equation-dimensions by an Euclidean metric. We have calculated the corrections to statefinder parameters due to variable gravitational constant equation in higher dimensional Cosmology. We have considered two special cases whether dark energy and dark matter interact or not. In a universe where gravitational constant is dynamic, the variable equation-correction to statefinder parameters is inevitable. The statefinder parameters are also obtained for generalized Chaplygin gas in the effect of the variation of equation correction.",12,[],5
1212.1021,physics,"We propose discrete-time polarization mode dispersion (PMD) models that are compatible with the emerging coherent receiver techniques, and statistical sampling schemes for the model parameters. These models use multiple-input multiple-output (MIMO) finite impulse response (FIR) filters that are lossless and therefore lend themselves as perfect candidates for emulation of fiber channels suffering from PMD without polarization dependent loss (PDL). The concatenated composition of these filters resembles the continuous time lumped model of PMD channels and offers a flexible emulator and compensator structure in terms of computational complexity which constitutes the main bottleneck for real-time DSP applications.",12,[],5
1209.1028,physics,"Many real-world networks display a natural bipartite structure, while analyzing or visualizing large bipartite networks is one of the most challenges. As a result, it is necessary to reduce the complexity of large bipartite systems and preserve the functionality at the same time. We observe, however, the existing coarse graining methods for binary networks fail to work in the bipartite networks. In this paper, we use the spectral analysis to design a coarse graining scheme specifically for bipartite networks and keep their random walk properties unchanged. Numerical analysis on artificial and real-world bipartite networks indicates that our coarse graining scheme could obtain much smaller networks from large ones, keeping most of the relevant spectral properties. Finally, we further validate the coarse graining method by directly comparing the mean first passage time between the original network and the reduced one.",12,[],5
1206.3428,physics,"Complex dielectric media often appear opaque because light traveling through them is scattered multiple times. Although the light scattering is a random process, different paths through the medium can be correlated encoding information about the medium. Here, we present spectroscopic measurements of nonuniversal intensity correlations that emerge when embedding quantum emitters inside a disordered photonic crystal that is found to Anderson-localize light. The emitters probe in-situ the microscopic details of the medium, and imprint such near-field properties onto the far-field correlations. Our findings provide new ways of enhancing light-matter interaction for quantum electrodynamics and energy harvesting, and may find applications in subwavelength diffuse-wave spectroscopy for biophotonics.",12,[],5
1202.1999,physics,"We introduce a powerful method for dynamical reconstruction of long-lived tracers such as ozone. It works by correlating the principal components of a matrix representation of the tracer dynamics with a series of sparse measurements. The method is tested on the 500 K isentropic surface using a simulated tracer and with ozone measurements from the Polar Aerosol and Ozone Measurement (POAM) III satellite instrument. The Lyapunov spectrum is measured and used to quantify the lifetime of each principal component. Using a 60 day lead time and five (5) principal components, cross validation of the reconstructed ozone and comparison with ozone sondes return root-mean-square errors of 0.20 ppmv and 0.47 ppmv, respectively.",12,[],5
1204.0618,physics,"In subwavelength-sized particles, light-induced multipole moments of orders higher than the electric dipole are usually negligibly small, which allows for the light-matter interaction to be accurately treated within the electric dipole approximation. In this work we show that in a specially designed meta-atom, a disc metadimer, the electric quadrupole and magnetic dipole can be the only excitable multipoles. This condition is achieved in a narrow but tunable spectral range of visible light both for individual metadimers and for a periodic array of such particles. The electromagnetic fields scattered by the metadimers fundamentally differ from those created by electric dipoles. A metamaterial composed of such metadimers will therefore exhibit unusual optical properties.",12,[],5
1202.1275,physics,"In recent papers we had developed a unified picture of black hole entropy and curvature which was shown to lead to Hawking radiation. It was shown that for any black hole mass, holography implies a phase space of just one quantum associated with the interior of the black hole. Here we study extremal rotating and charged black holes and obtain unique values for ratios of angular momentum to entropy, charge to entropy, etc. It turns out that these ratios can be expressed in terms of fundamental constants in nature, having analogies with other physical systems, like in condensed matter physics.",12,[],5
1203.5942,physics,"Recently developed series representations of the Boltzmann operator are used to obtain Quantum Mechanical results for the matrix elements, <x exp(-letter H)x>, of the imaginary time propagator. The calculations are done for two different potential surfaces: one of them is an Eckart Barrier and the other one is a double well potential surface. Numerical convergence of the series are investigated. Although the zeroth order term is sufficient at high temperatures, it does not lead to the correct saddle point structure at low temperatures where the tunneling is important. Nevertheless the series converges rapidly even at low temperatures. Some of the double well calculations are also done with the bare potential (without Gaussian averaging). Some equations of motion related with bare potentials are also derived. The use of the bare potential results in faster integrations of equations of motion. Although, it causes lower accuracy in the zeroth order approximation, the series show similar convergence properties both for Gaussian averaged calculations and the bare potential calculations. However, the series may not converge for bare potential calculations at low temperatures because of the low accuracy of zeroth order approximation. Interestingly, it is found that the number of saddle points of <x exp(-letter H)x> increases as the temperature is lowered. An explanation of observed structures at low temperatures remains as a challenge. Besides, it has implications for the quantum instanton theory of reaction rates at very low temperatures.",12,[],5
1204.5175,physics,This study deals with application of field equations in seven-dimensional space-and-time continuum to calculate geodetic and orbital gyroscope precession. It was demonstrated that unlike the classic theory the assumptions made completely correspond to the Gravity Probe B findings.,12,[],5
1209.3762,physics,"This article examines the theory of vortex flows in relation to the processes occurring in the radiation-wave cracking of crude oil, when the crude oil is sprayed into the gas stream in the form of a mist and then is fed into the reactor, where it is treated by the accelerated electrons and the UHF radiation. The output of this process are the products with the specified parameters (high-octane petroleum products). This process operates at the ambient pressure and temperature, which makes the process safer for industrial purposes. Besides the process itself, the authors described the equipment used in this process, as well as the parameters of the optimal process.",12,[],5
1201.2815,physics,The problem of spontaneous radiation of the electron bunch grazing into a charged metallic surface with randomly distributed needle shaped asperities is considered. Distances between two neighboring asperities have been described by gamma distribution. Being repealed by highly charged asperities the electrons of the bunch move along non-regular periodical trajectories in the planes parallel to the metallic surface. The spatial periods of the trajectories are random quantities which are described by the same gamma distribution. The radiation characteristics of the bunch have been obtained. It is shown that the angular distributions of the number of photons radiated from the bunch and from a single electron are the same but the frequency distribution of the bunch is being drastically changed at the hard frequency region. It is proposed to develop a new non-destructive method for investigation of the metal surface roughness. The frequency distribution of the number of photons radiated under the zero angle has been obtained. That allows to find the gain expression of the stimulated radiation.,12,[],5
1212.5717,physics,"We describe a fiber optical gyroscope based on the Sagnac effect realized on a multiplexed telecom fiber network. Our loop encloses an area of 20 km2 and coexists with Internet data traffic. This Sagnac interferometer achieves a sensitivity of about 1e-8 (rad/s)/sqrt(Hz), thus approaching ring laser gyroscopes without using narrow-linewidth laser nor sophisticated optics. The proposed gyroscope is sensitive enough for seismic applications, opening new possibilities for this kind of optical fiber sensors",12,[],5
1211.1720,physics,"A new approach to model order reduction of the Navier-Stokes equations at high Reynolds number is proposed. Unlike traditional approaches, this method does not rely on empirical turbulence modeling or modification of the Navier-Stokes equations. It provides spatial basis functions different from the usual proper orthogonal decomposition basis function in that, in addition to optimally representing the training data set, the new basis functions also provide stable and accurate reduced-order models. The proposed approach is illustrated with two test cases: two-dimensional flow inside a square lid-driven cavity and a two-dimensional mixing layer.",12,[],5
1212.3068,physics,"The vibrations of the soundboard of an upright piano in playing condition are investigated. It is first shown that the linear part of the response is at least 50 dB above its nonlinear component at normal levels of vibration. Given this essentially linear response, a modal identification is performed in the mid-frequency domain [300-2500] Hz by means of a novel high resolution modal analysis technique (Ege, Boutillon and David, JSV, 2009). The modal density of the spruce board varies between 0.05 and 0.01 modes/Hz and the mean loss factor is found to be approximately 2%. Below 1.1 kHz, the modal density is very close to that of a homogeneous isotropic plate with clamped boundary conditions. Higher in frequency, the soundboard behaves as a set of waveguides defined by the ribs. A numerical determination of the modal shapes by a finite-element method confirms that the waves are localised between the ribs. The dispersion law in the plate above 1.1 kHz is derived from a simple waveguide model. We present how the acoustical coincidence scheme is modified in comparison with that of thin plates. The consequences in terms of radiation of the soundboard in the treble range of the instrument are also discussed.",12,[],5
1208.5215,physics,"Perhaps more than any other of the physical sciences, cosmology exemplifies the inevitable contact between science and philosophy, including the problem of the demarcation criteria that distinguish science from non-science. Although modern physical cosmology is undoubtedly scientific, it is not obvious why it has this status, and nor is it obvious that all branches of theoretical cosmology satisfy ordinarily assumed criteria for science. While testability is generally admitted as an indispensable criterion for a theory being scientific, there is no agreement among cosmologists what testability means, more precisely. For example, should testability be taken to imply falsifiability in the sense of Popper? I discuss this and related questions by referring to two episodes of controversy in the history of modern cosmology, the debate over the steady state theory in the 1950s and the recent debate concerned with the anthropic multiverse. In addition, I draw attention to the use of historical analogies in cosmological and other scientific arguments, suggesting that such use is often misuse or otherwise based on distortions of the history of science.",12,[],5
1205.0057,physics,"An analysis of marathon pacing and elevation change is presented. It is based on an empirical observation of how the pace of elite and non-elite marathon runners change over the course of the marathon and a simple approximation of the energy cost of ascent and decent. It was observed that the pace of the runners slowed in a regular manner that could be broken up into four regions. That observation can be used to project target paces for a desired marathon finish time. However, that estimate fails to take in to account the energetic costs of elevation changes (hills) along the marathon course. Several approximations are made to give a coarse estimate of target paces for marathon run on courses with significant elevation changes, i.e. a hilly course. The 2012 Oakland Marathon course is used as and example of a hilly course and the times of 23 finishers are examined.",12,[],5
1211.5827,physics,"We show that the ideal (nondissipative) form of the dynamical equations for the Lipps-Hemler formulation of the anelastic fluid model follow as Euler-Poincar\'e equations, obtained from a constrained Hamilton's principle expressed in the Eulerian fluid description. This establishes the mathematical framework for the following properties of these anelastic equations: the Kelvin-Noether circulation theorem, conservation of potential vorticity on fluid parcels, and the Lie-Poisson Hamiltonian formulation possessing conserved Casimirs, conserved domain integrated energy and an associated variational principle satisfied by the equilibrium solutions. We then introduce a modified set of anelastic equations that represent the mean anelastic motion, averaged over subgrid scale rapid fluctuations, while preserving the mathematical properties of the Euler-Poincar\'e framework.",12,[],5
1201.3801,physics,"This study examines the performance of traditional round dowels in concrete floors and attempts to optimize the design of dowels through Finite Element (FE) analysis. A new type of Double-Tapered Round (DTR) dowels is proposed, and the performance of DTR dowels is compared to that of traditional cylindrical dowels. Linear Elastic (LE) analysis are performed in Abaqus (v-6.11) order to identify the optimized geometry of DTR dowels that would achieve (1) highest load transfer across adjacent slabs through shear action, and (2) lowest bearing stresses on the concrete. LE analyses are complemented by nonlinear FE analysis. The Riks method available in Abaqus/Standard, coupled with the Concrete Damaged Plasticity (CDP) model is used to simulate the degradation of concrete surrounding both DTR the traditional cylindrical dowels. Results obtained show that the use of DTR dowels can reduce bearing stresses at the face of the joint by as much 2.2 times as compared to traditional cylindrical dowels. While adequate load-transfer is a crucial part for the proper performance pavement structures, the load-transfer capacity of DTR dowels was more effective over cylindrical dowels by as far as 116%. In the inelastic range, even after significant concrete degradation and steel yielding, DTR dowels maintained a higher load-transfer capacity than traditional cylindrical dowels, and also presented lower amounts of differential deflections across concrete floors. Finally, damage in the concrete matrix below the dowel was relatively more confined for the case of DTR dowels, as compared to traditional cylindrical dowels.",12,[],5
1208.2044,physics,"In this paper we propose a simulation method using numerical integration, and develop a closed-form link loss model for physical layer channel characterization for non-line of sight (NLOS) ultraviolet (UV) communication systems. The impulse response of the channel is calculated by assuming both uniform and Gaussian profiles for transmitted beams and different geometries. The results are compared with previously published results. The accuracy of the integration approach is compared to the Monte Carlo simulation. Then the path loss using the simulation method and the suggested closed-form expression are presented for different link geometries. The accuracies are evaluated and compared to the results obtained using other methods.",12,[],5
1208.0426,physics,"The transverse bunch spectrum and the transverse decoherence/recoherence following an initial bunch offset are important phenomena in synchrotrons and storage rings, and are widely used for beam and lattice measurements. Incoherent shifts of the particles betatron frequency and of the synchrotron frequency modify the transverse spectrum and the bunch decoherence. In this study we analyze the effects of transverse space charge and of the rf nonlinearity on the decoherence signals. The transverse bunch decoherence and the resulting coherent spectra are measured in the SIS18 synchrotron at GSI Darmstadt for different bunch parameters. Particle tracking simulations together with an analytical model are used to describe the modifications in the decoherence signals and in the coherent spectra due to space charge and the rf bucket nonlinearity.",12,[],5
1212.3123,physics,"The sensitivity of inertial confinement fusion implosions of the type performed on the National Ignition Facility (NIF) to low-mode flux asymmetries has been investigated numerically. It is shown that large-amplitude, low-order mode shapes (Legendre polynomial P4), resulting from associated low order flux asymmetries, cause spatial variations in capsule and fuel momentum that prevent the DT ice layer from being decelerated uniformly by the hot spot pressure. This reduces the transfer of kinetic to internal energy of the central hot spot, thus reducing neutron yield. Furthermore, synthetic gated x-ray images of the hot spot self-emission indicate that P4 shapes may be unquantifiable for DT layered capsules. Instead the positive P4 asymmetry aliases itself as an oblate P4 in the x-ray self emission images. Correction of this apparent P2 distortion can further distort the implosion while creating a round x-ray image. Long wavelength asymmetries may be playing a significant role in the observed yield reduction of NIF DT implosions relative to detailed post-shot 2D simulations.",12,[],5
1201.2346,physics,"The concept of describing RF circuits in terms of waves is discussed and the S-matrix and related matrices are defined. The signal flow graph (SFG) is introduced as a graphical means to visualize how waves propagate in an RF network. The properties of the most relevant passive RF devices (hybrids, couplers, non-reciprocal elements, etc.) are delineated and the corresponding S-parameters are given. For microwave integrated circuits (MICs) planar transmission lines such as the microstrip line have become very important.",12,[],5
1208.0502,physics,"The transition radiation tracker (TRT) is the outermost of the three sub-systems of the ATLAS inner detector at the Large Hadron Collider (LHC) at CERN. It is designed to combine the drift tube tracker with the transition radiation detector, providing an important contribution to the charged particles precise momentum measurement and particle (mainly electron) identification. The TRT consists of a barrel section at small pseudorapidity (eta) and two separate end-cap partitions at large eta. The detector performance and its operational conditions were permanently monitored during all commissioning and data-taking stages using various software tools, one of which - TRTViewer - is described in the present paper. The TRTViewer is the dedicated program for monitoring the TRT raw data quality and detector performance at different hardware levels: individual straws, readout chips and electronic boards. The data analysis results can be presented on the event-by-event basis or in the form of color maps representing the operation parameters (efficiencies, timing, occupancy, etc.) according to the real geometrical position of the detector hardware elements. The paper describes the TRTViewer software package as the event displaying tool, raw data processor and histogram and operation parameters presenter, which works with the different sources of input information: raw data files, online monitoring histograms, offline analysis histograms and TRT DAQ Configuration database. The package proved to be one of the main instruments for the fast and effective TRT diagnostics during debugging and operation periods.",12,[],5
1201.1813,physics,In this short review we study the state of the art of the great problems in cosmology and their interrelationships. The reconciliation of these problems passes undoubtedly through the idea of a quantum universe.,12,[],5
1203.2952,physics,"Future LHC luminosity upgrades will significantly increase the amount of background hits from photons, neutrons and protons in the detectors of the ATLAS muon spectrometer. At the proposed LHC peak luminosity of 5*1034 1/cm2s, background hit rates of more than 10 kHz/cm2 are expected in the innermost forward region, leading to a loss of performance of the current tracking chambers. Based on the ATLAS Monitored Drift Tube chambers, a new high rate capable drift tube detecor using tubes with a reduced diameter of 15mm was developed. To test the response to highly ionizing particles, a prototype chamber of 46 15mm drift tubes was irradiated with a 20 MeV proton beam at the tandem accelerator at the Maier-Leibnitz Laboratory, Munich. Three tubes in a planar layer were irradiated while all other tubes were used for reconstruction of cosmic muon tracks through irradiated and non-irradiated parts of the chamber. To determine the rate capability of the 15mm drift-tubes we investigated the effect of the proton hit rate on pulse height, efficiency and spatial resolution of the cosmic muon signals.",12,[],5
1211.5717,physics,"We worked out a new group of collimated plasmon beams by the means of in-plane diffraction with symmetric phase modulation. As the phase type changes from 1.8 to 1.0, the beam undergoes an interesting evolution from focusing to a straight line. Upon this, an intuitive diagram was proposed to elucidate the beam nature and answer the question whether they are nondiffracting or linear focusing. Based on this diagram, we further achieved a highly designable scheme to modulate the beam intensity (e.g., 'lossless' plasmon). Our finding holds remarkable generality and flexibility in beam engineering and would inspire more intriguing photonic designs.",12,[],5
1205.4502,physics,"Fresnel Zone Plates (FZP) are to date very successful focusing optics for X-rays. Established methods of fabrication are rather complex and based on electron beam lithography (EBL). Here, we show that ion beam lithography (IBL) may advantageously simplify their preparation. A FZP operable from the extreme UV to the limit of the hard X-ray was prepared and tested from 450 eV to 1500 eV. The trapezoidal profile of the FZP favorably activates its 2nd order focus. The FZP with an outermost zone width of 100 nm allows the visualization of features down to 61, 31 and 21 nm in the 1st, 2nd and 3rd order focus respectively. Measured efficiencies in the 1st and 2nd order of diffraction reach the theoretical predictions.",12,[],5
