id,category,abstract,year,cross_lists,cat_int
1211.6135,hep-th,"Some of the supersymmetric nonlinear sigma models on exceptional groups (E7 or E8) are known to yield almost minimal necessary content of matter fields for phenomenological model building, including three chiral families and a Higgs multiplet. We explore a possible realization of such a family unification in heterotic string theory, where the spontaneously broken symmetry that we focus on is the one associated with the change of global orientation of the spin bundle embedded in the gauge bundle, which cannot be ignored in the presence of a magnetic source of the B field. We show in a simple model that it indeed gives rise to chiral matter fields on the defect similarly to the domain-wall fermions, and compare the chiral zero mode spectrum with the sigma model. The setup is reduced to a system similar to that postulated in the orbifold GUT or the grand gauge-Higgs unification model, where the origin of Z2 identification is accounted for as arising from the bolt of the Atiyah-Hitchin manifold.",12,[],4
1201.1220,hep-th,In this paper we will analyse the Aharony-Bergman-Jafferis-Maldacena (ABJM) theory in equation superspace formalism. We then study the quantum gauge transformations for this ABJM theory in gaugeon formalism. We will also analyse the extended BRST symmetry for this ABJM theory in gaugeon formalism and show that these BRST transformations for this theory are nilpotent and this in turn leads to the unitary evolution of the equation-matrix.,12,[],4
1210.5008,hep-th,"We derive an exact closed-form representation for the Euclidean thermal Green function of the two-dimensional (2D) free massless scalar field in coordinate space. This can be interpreted as the real part of a complex analytic function of a variable that conformally maps the infinite strip equation (equation) of the equation (equation: imaginary time) plane into the upper-half-plane. Use of the Cauchy-Riemann conditions, then allows us to identify the dual thermal Green function as the imaginary part of that function.",12,[],4
1203.5677,hep-th,Elliptic hypergeometric integrals describe superconformal indices of 4d supersymmetric field theories. We show that all 't Hooft anomaly matching conditions for Seiberg dual theories can be derived from equation-modular transformation properties of the kernels of dual indices.,12,[],4
1207.5740,hep-th,General 1-point toric blocks in all sectors of N=1 superconformal field theories are analyzed. The recurrence relations for blocks coefficients are derived by calculating their residues and large equation asymptotics.,12,[],4
1209.5900,hep-th,"Using AdS/CFT correspondence, the effect of alpha'-correction on the value of Chiral Magnetic Effect(CME) is computed by adding a number of spinning probe D7-branes in the equation-corrected background. We show that although for the massive solutions the magnitude of CME increases in the presence of alpha'-correction, it does not change for the massless solution. However some of the D7-brane embeddings have no CME, after applying alpha'-correction, they find a non-zero value for the CME. As a result the number of solutions with a non-zero CME increases. We also show that the effect of alpha'-correction removes the singularity from some of the D7-brane embeddings.",12,[],4
1212.6257,hep-th,"Using the recent formula presented by He and Cachazo-Mason-Skinner for the link representation of tree-level N=8 supergravity amplitudes, we derived a CSW-like expansion for the Next-to-MHV 6- and 7-graviton amplitudes by using the global residue theorem; a technique introduced originally for Yang-Mills amplitudes. We analytically checked the equivalence of one of the CSW terms and its corresponding Risager's diagram. For the remaining 6-graviton and all 7-graviton terms, we numerically checked the agreement with Risager's expansion. We showed that the conditions for the absence of contributions at infinity of the global residue theorem are satisfied for any number of particles. This means that our technique and Risager's should disagree starting at twelve particles where Risager's method is known to fail.",12,[],4
1203.4236,hep-th,"We compute the low energy spectral density of transverse currents in theories with holographic duals that exhibit an emergent scaling symmetry characterized by dynamical critical exponent equation and hyperscaling violation exponent equation. For any finite equation and equation, the low energy spectral density is exponentially small at nonzero momentum. This indicates that any nonzero momentum low energy excitations of putative hidden Fermi surfaces are not visible in the classical bulk limit. We furthermore show that if the limit equation is taken with the ratio equation held fixed, then the resulting theory is locally quantum critical with an entropy density that vanishes at low temperatures as equation. In these cases the low energy spectral weight at nonzero momentum is not exponentially suppressed, possibly indicating a more fermionic nature of these theories.",12,[],4
1207.3763,hep-th,"In this note we derive equation-behavior at large t' Hooft coupling for the free energy of 5D maximally supersymmetric Yang-Mills theory on equation. We also consider a equation quiver of this model, as well as a model with equation hypermultiplets in the fundamental representation. We compare the results to the supergravity description and comment on their relation.",12,[],4
1201.4231,hep-th,We show how D-instanton corrections modify the dilaton-axion profile emitted by an O7/D7 system turning it into the non-singular F-theory background which corresponds to the effective coupling on a D3 probe.,12,[],4
1205.0176,hep-th,"Non-compact symmetries of extended 4d supergravities involve duality rotations of vectors and thus are not manifest off-shell invariances in standard ""second-order"" formulation. To study how such symmetries are realised in the quantum theory we consider examples in 2 dimensions where vector-vector duality is replaced by scalar-scalar one. Using a ""doubled"" formulation, where fields and their momenta are treated on an equal footing and the duality becomes a manifest symmetry of the action (at the expense of Lorentz symmetry), we argue that the corresponding on-shell quantum effective action or S-matrix are duality symmetric as well as Lorentz invariant. The simplest case of discrete Z2 duality corresponds to a symmetry of the S-matrix under flipping the sign of the negative-chirality scalars in 2 dimensions or phase rotations of chiral (definite-helicity) parts of vectors in 4 dimensions. We also briefly discuss some 4d models and comment on implications of our analysis for extended supergravities.",12,[],4
1205.3847,hep-th,"When matter falls past the horizon of a large black hole, the expectation from string theory is that the configuration thermalizes and the information in the probe is rather quickly scrambled away. The traditional view of a classical unique spacetime near a black hole horizon conflicts with this picture. The question then arises as to what spacetime does the probe actually see as it crosses a horizon, and how does the background geometry imprint its signature onto the thermal properties of the probe. In this work, we explore these questions through an extensive series of numerical simulations of D0 branes. We determine that the D0 branes quickly settle into an incompressible symmetric state -- thermalized within a few oscillations through a process driven entirely by internal non-linear dynamics. Surprisingly, thermal background fluctuations play no role in this mechanism. Signatures of the background fields in this thermal state arise either through fluxes, i.e. black hole hair; or if the probe expands to the size of the horizon -- which we see evidence of. We determine simple scaling relations for the D0 branes' equilibrium size, time to thermalize, lifetime, and temperature in terms of their number, initial energy, and the background fields. Our results are consistent with the conjecture that black holes are the fastest scramblers as seen by Matrix theory.",12,[],4
1212.4706,hep-th,"We construct rigid supersymmetric theories for interacting vector and tensor multiplets on six-dimensional Riemannian spin manifolds. Analyzing the Killing spinor equations, we derive the constraints on these theories. To this end, we reformulate the conditions for supersymmetry as a set of necessary and sufficient conditions on the geometry. The formalism is illustrated with a number of examples, including manifolds that are hermitian, strong Kaehler with torsion. As an application, we show that the path integral of pure super Yang-Mills theory defined on a Calabi-Yau threefold M6 localizes on stable holomorphic bundles over M6.",12,[],4
1205.0491,hep-th,"The infrared behavior of gluon and ghost propagators in Landau gauge Yang-Mills theory has been at the center of an intense debate over the last decade. Different solutions of the Dyson-Schwinger equations show a different behavior of the propagators in the infrared: in the so-called scaling solutions both propagators follow a power law, while in the decoupling solutions the gluon propagator shows a massive behavior. The latest lattice results favor the decoupling solutions. In this contribution, after giving a brief overview of the present status of analytical and semi-analytical approaches to the infrared regime of Landau gauge Yang-Mills theory, we will show how Callan-Symanzik renormalization group equations in an epsilon expansion reproduce both types of solutions and single out the decoupling solutions as the infrared-stable ones for space-time dimensions greater than two, in agreement with the lattice calculations.",12,[],4
1207.0224,hep-th,A perfectly reflecting (Dirichlet) boundary condition at the edge of an impenetrable magnetic-flux-carrying tube of nonzero transverse size is imposed on the charged massive scalar matter field which is quantized outside the tube on a plane which is transverse to the tube. We show that the vacuum polarization effects outside the tube give rise to a macroscopic force acting at the increase of the tube radius (if the magnetic flux is held steady).,12,[],4
1202.2149,hep-th,"The correspondence between the semiclassical limit of the DOZZ quantum Liouville theory and the Nekrasov-Shatashvili limit of the N = 2 (Omega-deformed) U(2) super-Yang-Mills theories is used to calculate the unknown accessory parameter of the Fuchsian uniformization of the 4-punctured sphere. The computation is based on the saddle point method. This allows to find an analytic expression for the Nf = 4, U(2) instanton twisted superpotential and, in turn, to sum up the 4-point classical block. It is well known that the critical value of the Liouville action functional is the generating function of the accessory parameters. This statement and the factorization property of the 4-point action allow to express the unknown accessory parameter as the derivative of the 4-point classical block with respect to the modular parameter of the 4-punctured sphere. It has been found that this accessory parameter is related to the sum of all rescaled column lengths of the so-called 'critical' Young diagram extremizing the instanton 'free energy'. It is shown that the sum over the 'critical' column lengths can be rewritten in terms of a contour integral in which the integrand is built out of certain special functions closely related to the ordinary Gamma function.",12,[],4
1206.1048,hep-th,"We study the electromagnetic coupling of massless higher-spin fermions in flat space. Under the assumptions of locality and Poincare invariance, we employ the BRST-BV cohomological methods to construct consistent parity-preserving off-shell cubic 1-s-s vertices. Consistency and non-triviality of the deformations not only rule out minimal coupling, but also restrict the possible number of derivatives. Our findings are in complete agreement with, but derived in a manner independent from, the light-cone-formulation results of Metsaev and the string-theory-inspired results of Sagnotti-Taronna. We prove that any gauge-algebra-preserving vertex cannot deform the gauge transformations. We also show that in a local theory, without additional dynamical higher-spin gauge fields, the non-abelian vertices are eliminated by the lack of consistent second-order deformations.",12,[],4
1206.4337,hep-th,"We extend a recently proposed Quantum Field Theory (QFT) approach to the Lifshitz formula, originally implemented for a real scalar field, to the case of a fluctuating vacuum electromagnetic (EM) field, coupled to two flat, parallel mirrors. The general result is presented in terms of the invariants of the vacuum polarization tensors due to the media on each mirror. We consider mirrors that have small widths, with the zero-width limit as a particular case. We apply the latter to models involving graphene sheets, obtaining results which are consistent with previous ones.",12,[],4
1203.4689,hep-th,"An overview is given of the way in which the unification program of particle physics has evolved into the proposal of superstring theory as a prime candidate for unifying quantum gravity with the other forces and particles of nature. A key concern with quantum gravity has been the problem of ultraviolet divergences, which is naturally solved in string theory by replacing particles with spatially extended states as the fundamental excitations. String theory turns out, however, to contain many more extended-object states than just strings. Combining all this into an integrated picture, called M-theory, requires recognition of the r\ole played by a web of nonperturbative duality symmetries suggested by the nonlinear structures of the field-theoretic supergravity limits of string theory.",12,[],4
1207.4064,hep-th,"We derive a link representation for all tree amplitudes in N=8 supergravity, from a recent conjecture by Cachazo and Skinner. The new formula explicitly writes amplitudes as contour integrals over constrained link variables, with an integrand naturally expressed in terms of determinants, or equivalently tree diagrams. Important symmetries of the amplitude, such as supersymmetry, parity and (partial) permutation invariance, are kept manifest in the formulation. We also comment on rewriting the formula in a GL(k)-invariant manner, which may serve as a starting point for the generalization to possible Grassmannian contour integrals.",12,[],4
1207.5953,hep-th,"Gauge/gravity duality is a useful and efficient tool for addressing and studying questions related to strongly interacting systems described by a gauge theory. In this manuscript we will review a number of interesting phenomena that occur in such systems when a background magnetic field is turned on. Specifically, we will discuss holographic models for systems that include matter fields in the fundamental representation of the gauge group, which are incorporated by adding probe branes into the gravitational background dual to the gauge theory. We include three models in this review: the D3-D7 and D4-D8 models, that describe four-dimensional systems, and the D3-D7' model, that describes three-dimensional fermions interacting with a four-dimensional gauge field.",12,[],4
1207.3473,hep-th,"In this article, we use Ward identity to calculate tree and one loop level off shell amplitudes in pure Yang-Mills theory with a pair of external lines complexified. We explicitly prove Ward identity at tree and one loop level using Feynman rules, and then give recursion relations for the off shell amplitudes. We find that the cancellation details in the proof of Ward identity simplifies our derivation of the recursion relations. Then we calculate three and four point one loop off shell amplitudes as examples of our method.",12,[],4
1202.1952,hep-th,"This paper explores long-range interactions between magnetically-charged excitations of the vacuum of the dual Landau-Ginzburg theory (DLGT) and the dual Abrikosov vortices present in the same vacuum. We show that, in the London limit of DLGT, the corresponding Aharonov-Bohm-type interactions possess such a coupling that the interactions reduce to a trivial factor of e2letter i (integer). The same analysis is done in the SU(Nc)-inspired [U(1)]Nc-1-invariant DLGT, as well as in DLGT extended by a Chern-Simons term. It is furthermore explicitly shown that the Chern-Simons term leads to the appearance of knotted dual Abrikosov vortices.",12,[],4
1203.3544,hep-th,"We study the thermal partition function of quantum field theories on arbitrary stationary background spacetime, and with arbitrary stationary background gauge fields, in the long wavelength expansion. We demonstrate that the equations of relativistic hydrodynamics are significantly constrained by the requirement of consistency with any partition function. In examples at low orders in the derivative expansion we demonstrate that these constraints coincide precisely with the equalities between hydrodynamical transport coefficients that follow from the local form of the second law of thermodynamics. In particular we recover the results of Son and Surowka on the chiral magnetic and chiral vorticity flows, starting from a local partition function that manifestly reproduces the field theory anomaly, without making any reference to an entropy current. We conjecture that the relations between transport coefficients that follow from the second law of thermodynamics agree to all orders in the derivative expansion with the constraints described in this paper.",12,[],4
1203.5107,hep-th,"We study the Borcherds superalgebra obtained by adding an odd (fermionic) null root to the set of simple roots of a simple finite-dimensional Lie algebra. We compare it to the Kac-Moody algebra obtained by replacing the odd null root by an ordinary simple root, and then adding more simple roots, such that each node that we add to the Dynkin diagram is connected to the previous one with a single line. This generalizes the situation in maximal supergravity, where the E(n) symmetry algebra can be extended to either a Borcherds superalgebra or to the Kac-Moody algebra E(11), and both extensions can be used to derive the spectrum of p-form potentials in the theory. We show that also in the general case, the Borcherds and Kac-Moody extensions lead to the same p-form spectrum of representations of the simple finite-dimensional Lie algebra.",12,[],4
1208.1232,hep-th,"We show how the SL(5) duality in M-theory is explained from a canonical analysis of M2-brane mechanics. Diffeomorphism constraints for a M2-brane coupled to supergravity background in d=4 are reformulated in a SL(5) covariant form, in which spatial diffeomorphism constraints are recast into a SL(5) vector and the generalized metric in the Hamiltonian constraint is quartic in the SL(5) generalized vielbein. The Hamiltonian for a M2 brane has the SL(5) duality symmetry in a background dependent gauge.",12,[],4
1210.1856,hep-th,"N=1 super Liouville field theory is one of the simplest non-rational conformal field theories. It possesses various important extensions and interesting applications, e.g. to the AGT relation with 4D gauge theory or the construction of the OSP(12) WZW model. In both setups, the N=1 Liouville field is accompanied by an additional free fermion. Recently, Belavin et al. suggested a bosonization of the product theory in terms of two bosonic Liouville fields. While one of these Liouville fields is standard, the second turns out to be imaginary (or time-like). We extend the proposal to the R sector and perform extensive checks based on detailed comparison of 3-point functions involving several super-conformal primaries and descendants. On the basis of such strong evidence we sketch a number of interesting potential applications of this intriguing bosonization.",12,[],4
1212.1212,hep-th,"Chiral gauge theories in two dimensions with (0,2) supersymmetry are central in the study of string compactifications. Remarkably little is known about generic (0,2) theories. We consider theories with branches on which multiplets with a net gauge anomaly become massive. The simplest example is a relevant perturbation of the gauge theory that flows to the CP(n) model. To compute the effective action, we derive a useful set of Feynman rules for (0,2) supergraphs. From the effective action, we see that the infra-red geometry reflects the gauge anomaly by the presence of a boundary at finite distance. In generic examples, there are boundaries, fluxes and branes; the resulting spaces are non-Kahler.",12,[],4
1208.0058,hep-th,"For the N=2 Kazama-Suzuki(KS) model on CP3, the lowest higher spin current with spins (2, 5/2, 5/2,3) is obtained from the generalized GKO coset construction. By computing the operator product expansion of this current and itself, the next higher spin current with spins (3, 7/2, 7/2, 4) is also derived. This is a realization of the N=2 WN1 algebra with N=3 in the supersymmetric WZW model. By incorporating the self-coupling constant of lowest higher spin current which is known for the general (N,k), we present the complete nonlinear operator product expansion of the lowest higher spin current with spins (2, 5/2, 5/2, 3) in the N=2 KS model on CPN space. This should coincide with the asymptotic symmetry of the higher spin AdS3 supergravity at the quantum level. The large (N,k) 't Hooft limit and the corresponding classical nonlinear algebra are also discussed.",12,[],4
1206.5966,hep-th,"It is shown by using localization that in five-dimensional N=1 supersymmetric Yang-Mills theory on a three-dimensional sphere, correlation functions in a sector are identical to correlation functions in two-dimensional bosonic Yang-Mills theory.",12,[],4
1206.1536,hep-th,"For supersymmetric solutions of D3(M2) branes with AdS3(AdS2) factor, it is known that the internal space is expressible as U(1) fibration over Kahler space which satisfies a specific partial differential equation involving the Ricci tensor. In this paper we study the wrapped brane solutions of D3 and M2-branes which were originally constructed using gauged supergravity and uplifted to D=10 and D=11. We rewrite the solutions in canonical form, identify the backreacted Kahler geometry, and present a class of solutions which satisfy the Killing spinor equation.",12,[],4
1207.4359,hep-th,"We apply the technique of supersymmetric localization to exactly compute the equation partition function of several large equation superconformal field theories in five dimensions that have equation duals in massive type IIA supergravity. The localization computations are performed in the non-renormalizable effective field theories obtained through relevant deformations of the UV superconformal field theories. We compare the equation free energy to a holographic computation of entanglement entropy in the equation duals and find perfect agreement. In particular, we reproduce the equation scaling of the equation free energy that was expected from supergravity.",12,[],4
1203.5376,hep-th,We initiate a study of correlation functions of gauge-invariant operators in N=4 super Yang-Mills theory using the light-cone superspace formalism. Our primary aim is to develop efficient methods to compute perturbative corrections to correlation functions. This analysis also allows us to examine potential subtleties which may arise when calculating off-shell quantities in light-cone gauge. We comment on the intriguing possibility that the manifest N=4 supersymmetry in this approach may allow for a compact description of entire multiplets and their correlation functions.,12,[],4
1206.5815,hep-th,"We identify a simple mechanism by which H-flux satisfying the modified Bianchi identity arises in garden-variety (0,2) gauged linear sigma models. Taking suitable limits leads to effective gauged linear sigma models with Green-Schwarz anomaly cancellation. We test the quantum-consistency of a class of such effective theories by constructing an off-shell superconformal algebra, providing evidence that these models run to good CFTs in the deep IR.",12,[],4
1202.2735,hep-th,"Following earlier work, we view two dimensional non-linear sigma model with target space equation as a single particle relativistic quantum mechanics in the corresponding free loop space equation. In a natural semi-classical limit (equation) of this model the wavefunction localizes on the submanifold of vanishing loops which is isomorphic to equation. One would expect that the relevant semi-classical expansion should be related to the tubular expansion of the theory around the submanifold and an effective dynamics on the submanifold is obtainable using Born-Oppenheimer approximation. In this work we develop a framework to carry out such an analysis at the leading order in equation-expansion. In particular, we show that the linearized tachyon effective equation is correctly reproduced up to divergent terms all proportional to the Ricci scalar of equation. The steps leading to this result are as follows: first we define a finite dimensional analogue of the loop space quantum mechanics (LSQM) where we discuss its tubular expansion and how that is related to a semi-classical expansion of the Hamiltonian. Then we study an explicit construction of the relevant tubular neighborhood in equation using exponential maps. Such a tubular geometry is obtained from a Riemannian structure on the tangent bundle of equation which views the zero-section as a submanifold admitting a tubular neighborhood. Using this result and exploiting an analogy with the toy model we arrive at the final result for LSQM.",12,[],4
