id,category,abstract,year,cross_lists,cat_int
1105.2498,nucl-th,"We investigate the effect of the alignment of the magnetic moments of Cooper pairs of charged quarks that form at high density in three-flavor quark matter. The high density phase of this matter in the presence of a magnetic field is known to be the Magnetic Color-Flavor-Locked (MCFL) phase of color superconductivity. We derive the Fierz identities of the theory and show how the explicit breaking of the rotational symmetry by the uniform magnetic field field opens new channels of interactions and allows the formation of a new diquark condensate. The new order parameter is a spin-1 diquark condensate proportional to the component in the field direction of the average magnetic moment of the pairs of charged quarks. In the region of large fields, the new condensate's magnitude becomes comparable to the larger of the two scalar gaps. Since there is no solution of the gap equations with nonzero scalar gaps and zero value of this magnetic moment condensate, its presence in the MCFL phase is unavoidable. This is consistent with the fact that the extra condensate does not break any symmetry that has not already been broken by the known MCFL gaps. The spin-1 condensate enhances the condensation energy of pairs formed by charged quarks and the magnetization of the system. We discuss the possible consequences of the new order parameter on the issue of the chromomagnetic instability that appears in color superconductivity at moderate density.",11,['hep-ph'],11
1105.4528,nucl-th,"The two-Equation of State (Two-EoS) model is used to describe the hadron-quark phase transition in dense-hot matter formed in heavy-ion collisions. The non-linear Walecka model is used to describe the hadronic phase. For the quark phase, the Nambu--Jona-Lasinio model coupled to Polyakov-Loop fields (PNJL) is used to include both the chiral and (de)confinement dynamics. The phase diagrams are derived from the Gibbs conditions and compared with the results obtained in the Hadron-NJL model without confinement. As in the Hadron-NJL case a first order transition is observed, but with a Critical-End-Point at much higher temperature, consequence of the confinement mechanism that reduces the degrees of freedom of the quark matter in proximity of the phase transition. Particular attention is devoted to the phase transition in isospin asymmetric matter. Interesting isospin effects are found at high baryon density and reduced temperatures, in fact common also to other quark models, like MIT-Bag and NJL model. Some possible observation signals are suggested to probe in Heavy-Ion Collision (HIC) experiments at intermediate energies.",11,"['hep-ph', 'nucl-ex']",11
1104.4638,nucl-th,"The shapes of light normal nuclei and equation hypernuclei are investigated in the equation deformation plane by using a newly developed constrained relativistic mean field (RMF) model. As examples, the results of some C, Mg, and Si nuclei are presented and discussed in details. We found that for normal nuclei the present RMF calculations and previous Skyrme-Hartree-Fock models predict similar trends of the shape evolution with the neutron number increasing. But some quantitative aspects from these two approaches, such as the depth of the minimum and the softness in the equation direction, differ a lot for several nuclei. For equation hypernuclei, in most cases, the addition of a equation hyperon alters slightly the location of the ground state minimum towards the direction of smaller equation and softer equation in the potential energy surface equation. There are three exceptions, namely, equationC, equationC, and equationSi in which the polarization effect of the additional equation is so strong that the shapes of these three hypernuclei are drastically different from their corresponding core nuclei.",11,['nucl-ex'],11
1101.0453,nucl-th,"The S-wave Sigmac Dbar and Lambdac Dbar states with isospin I=1/2 and spin S=1/2 are dynamically investigated within the framework of a chiral constituent quark model by solving a resonating group method (RGM) equation. The results show that the interaction between Sigmac and Dbar is attractive, which consequently results in a Sigmac Dbar bound state with the binding energy of about 5-42 MeV, unlike the case of Lambdac Dbar state, which has a repulsive interaction and thus is unbound. The channel coupling effect of Sigmac Dbar and Lambdac Dbar is found to be negligible due to the fact that the gap between the Sigmac Dbar and Lambdac Dbar thresholds is relatively large and the Sigmac Dbar and Lambdac Dbar transition interaction is weak.",11,['hep-ph'],11
1104.4885,nucl-th,"We consider the NN interaction in pionless effective field theory (EFT) up to next-to-next-to-leading order (NNLO) and use a recursive subtractive renormalization scheme to describe NN scattering in the 1S0 channel. We fix the strengths of the contact interactions at a reference scale, chosen to be the one that provides the best fit for the phase-shifts, and then slide the renormalization scale by evolving the driving terms of the subtracted Lippmann-Schwinger equation through a non-relativistic Callan-Symanzik equation. The results show that such a systematic renormalization scheme with multiple subtractions is fully renormalization group invariant.",11,[],11
1109.6325,nucl-th,"In tackling QCD, a constructive feedback between theory and extant and forthcoming experiments is necessary in order to place constraints on the infrared behaviour of QCD's letter-function, a key nonperturbative quantity in hadron physics. The Dyson-Schwinger equations provide a tool with which to work toward this goal. They connect confinement with dynamical chiral symmetry breaking, both with the observable properties of hadrons, and hence provide a means of elucidating the material content of real-world QCD. This contribution illustrates these points via comments on: in-hadron condensates; dressed-quark anomalous chromo- and electro-magnetic moments; the spectra of mesons and baryons, and the critical role played by hadron-hadron interactions in producing these spectra.",11,"['hep-lat', 'hep-ph', 'nucl-ex']",11
1110.1279,nucl-th,"Time reversal invariance violating (TRIV) effects in neutron scattering are very important in a search for new physics, being complementary to neutron and atomic electric dipole moment measurements. In this relation, a sensitivity of TRIV observables to different models of CP-violation and their dependencies on nuclear structure, which can lead to new enhancement factors, are discussed.",11,['hep-ph'],11
1111.6122,nucl-th,"We give an overview of some results presented at the Strange Quark Matter 2011 conference in Krakow, and interpret them in light of the search of the search for a QCD deconfinement phase transition in heavy ion collisions",11,"['hep-ex', 'hep-ph', 'nucl-ex']",11
1112.2798,nucl-th,"With the improved scission-point model the mass distributions are calculated for induced fission of different Hg isotopes with the masses 180-196. The drastic change in the shape of the mass distribution from asymmetric to symmetric is revealed with increasing mass number of the fissioning Hg isotope, and the reactions are proposed to verify this prediction experimentally. The asymmetric mass distribution of fission fragments observed in the recent experiment on the fission of 180Hg is explained. The calculated mass distribution and mean total kinetic energy of fission fragments are in a good agreement with the available experimental data.",11,['nucl-ex'],11
1102.1802,nucl-th,The fragmentation of projectile and spectator is studied at the different incident energies using isospin dependent QMD model with reduced isospin dependent cross-section. Different systems have been used for the analysis of fragment production(IMF). We have used enhanced constant isospin dependent cross-section to explain the experimental findings which is valid for soft equation of state. In addition to that we have tried to study the influence of density dependent symmetry energy on fragment production.,11,[],11
1104.3240,nucl-th,"We study the role of colliding geometry on the balance energy (Ebal) of mass-asymmetric systems by varying the mass asymmetry (letter = AT - Ap/AT  AP, where AT and AP are the masses of the target and projectile, respectively) from 0.1 to 0.7, over the mass range 40-240 and on the mass dependence of the balance energy. Our findings reveal that colliding geometry has a significant effect on the Ebal of asymmetric systems. We find that, as we go from central collisions to peripheral ones, the effect of mass asymmetry on Ebal increases throughout the mass range. Interestingly, we find that for every fixed system mass (Atot) the effect of the impact parameter variation is almost uniform throughout the mass-asymmetry range. For each letter, Ebal follows a power-law behavior (\propto Aletter) at all colliding geometries",11,[],11
1101.4483,nucl-th,"In this paper a short review of the theoretical problems of the pionic radioactivity as a new nuclear mode is presented. The essential theoretical and experimental results obtained in the 25 years from the prediction of the nuclear pionic radioactivity are reviewed. Using the fission-like model it was shown that most of the SHE-nuclei lie in the region where the pionic fissility parameters attain their limiting value X=1 (see Fig.2-3). Hence, the SHE-region is characterized by the absence of a classical barrier toward spontaneous pion emission. Consequently, both decay modes, the pionic fission and the spontaneous fission of SHE nuclides, essentially will be determined only by shell effects. Then, it was seen that the usual predicted SHE-island of stability around the double magic nucleus 298-[114], which is not confirmed experimentally, can be explained by the dominant pionic radioactivity of the SHE-nuclei from this region. The bimodal symmetric (see Figs. 5ab) as well as, the supergiant radioactive halos (see Fig. 6) as two important signature of the nuclear pionic fission are evidentiated.",11,[],11
1101.4045,nucl-th,"The Schrodinger equation with the trigonometric Rosen-Morse potential in flat three dimensional Euclidean space, E3, and its exact solutions are shown to be also exactly transformable to momentum space, though the resulting equation is purely algebraic and can not be cast into the canonical form of an integral Lippmann-Schwinger equation. This is because the cotangent function does not allow for an exact Fourier transform in E3. In addition we recall, that the above potential can be also viewed as an angular function of the second polar angle parametrizing the three dimensional spherical surface, S3, of a constant radius, in which case the cotangent function would allow for an exact integral transform to momentum space. On that basis, we obtain a momentum space Lippmann-Schwinger-type equation, though the corresponding wavefunctions have to be obtained numerically.",11,"['hep-ph', 'quant-ph']",11
1105.5029,nucl-th,"We have performed a calculation for the three body equation system by using the fixed center approximation to Faddeev equations, taking the interaction between equation and equation, equation andequation, and equation and equation from the chiral unitary approach. We find several peaks in the modulus squared of the three-body scattering amplitude, indicating the existence of resonances, which can be associated to known equation and equation and equation baryon states.",11,[],11
1103.5563,nucl-th,We consider the most negative and most positive value of the spin operator for a many nucleon system. In the usual Nilsson model and in the single nucleon model this value has a narrow range.In the Nilsson model with an excited intrinsic state we can get values of the spin operator greater than one.,11,['nucl-ex'],11
1103.1358,nucl-th,"We investigate the linear-chain structures in highly excited states of equationC using a generalized molecular orbital model, by which we incorporate an asymmetric configuration of three equation clusters in the linear-chain states. By applying this model to the equationC system, we study the equationBeequation correlation in the linear-chain state of equationC. To clarify the origin of the equationBeequation correlation in the equationC linear-chain state, we analyze linear equation and equation systems in a similar way. We find that a linear 3equation system prefers the asymmetric 2equation configuration, whose origin is the many body correlation incorporated by the parity projection. This configuration causes an asymmetric mean field for two valence neutrons, which induces the concentration of valence neutron wave functions around the correlating 2equation. A linear-chain structure of equationC is also discussed.",11,[],11
1102.4574,nucl-th,"We analyze dilepton emission from hot and dense matter using a hybrid approach based on the Ultrarelativistic Quantum Molecular Dynamics (UrQMD) transport model with an intermediate hydrodynamic stage for the description of heavy-ion collisions at relativistic energies. During the hydrodynamic stage, the production of lepton pairs is described by radiation rates for a strongly interacting medium in thermal equilibrium. In the low mass region, hadronic thermal emission is evaluated assuming vector meson dominance including in-medium modifications of the rho meson spectral function through scattering from nucleons and pions in the heat bath. In the intermediate mass region, the hadronic rate is essentially determined by multi-pion annihilation processes. Emission from quark-antiquark annihilation in the quark gluon plasma is taken into account as well. When the system is sufficiently dilute, the hydrodynamic description breaks down and a transition to a final cascade stage is performed. In this stage dimuon emission is evaluated as commonly done in transport models. Focusing on the enhancement with respect to the contribution from long-lived hadron decays after freezout observed at the SPS in the low mass region of the dilepton spectra, the relative importance of the different thermal contributions and of the two dynamical stages is investigated. We find that three separated regions can be identified in the invariant mass spectra. Whereas the very low and the intermediate mass regions mostly receive contribution from the thermal dilepton emission, the region around the vector meson peak is dominated by the cascade emission. Above the rho-peak region the spectrum is driven by QGP radiation. Analysis of the dimuon transverse mass spectra reveals that the thermal hadronic emission shows an evident mass ordering not present in the emission from the QGP.",11,['hep-ph'],11
1108.6230,nucl-th,"We investigate the microscopic origin of the relaxation time coefficient in relativistic fluid dynamics. We show that the extraction of the shear viscosity relaxation time via the gradient expansion is ambiguous and in general fails to give the correct result. The correct value for the shear viscosity relaxation time is extracted from the slowest non-hydrodynamic pole of the corresponding retarded Green's function, if such a pole is purely imaginary. According to the AdS/CFT correspondence, in strongly-coupled equation SYM the non-hydrodynamic poles of the shear stress tensor nearest to the origin have a nonzero real part, which implies that the transient fluid-dynamical equations for this gauge theory are not equivalent to the well-known Israel-Stewart equations.",11,"['hep-ph', 'hep-th']",11
1101.4717,nucl-th,In the presented review we discuss the problem of extraction the parameters of nuclear matter and charge distribution in stable and unstable isotopes. A substantial amount of information on the nuclear radii and other distribution parameters in light exotic nuclei has been obtained from experiments on intermediate-energy nucleus-nucleus collisions. The analyses of these experiments is usually performed with the help of the Glauber Theory. We review the main assumptions the Glauber Theory and show how this theoretical approach is used to calculate reaction and interaction cross sections. We also show how radii of nuclear matter can be obtained from the analysis of the experimental data on reaction cross sections. In the provided analysis reaction cross sections were calculated in optical and rigid approximations of the Glauber Theory as well as using explicit expressions. Numerical calculations of Glauber's explicit expressions for reaction cross sections were done using Monte Carlo technique. Recent results of the precise measurements of charge radii of light exotic nuclei which were done using the laser-spectroscopy technique as well as the method of the investigation of the nuclear matter distributions in proton elastic scattering experiments in inverse kinematics are also discussed.,11,[],11
1110.4063,nucl-th,"A mini-review of non-uniform phases in quark matter is presented, with particular attention to the pion condensation, also known as chiral density waves or chiral spirals. The phase diagram of strongly-interacting matter may involve such a phase, placed on the quarkyonic island between the baryonic phase and the chirally-restored quark-gluon plasma.",11,['hep-ph'],11
1103.4062,nucl-th,"The recently derived long-range two-pion exchange (TPE) contributions to the nuclear current operator which appear at next-to-leading order (NLO) of the chiral expansion are used to describe electromagnetic processes. We study their role in the photodisintegration of 2H and 3He and compare our predictions with experimental data. The bound and scattering states are calculated using five different parametrizations of the chiral next-to-next-to-leading order (N2LO) nucleon-nucleon (NN) potential which allows us to estimate the theoretical uncertainty at a given order in the chiral expansion. For some observables the results are very close to the predictions based on the AV18 NN potential and the current operator (partly) consistent with this force. In the most cases, the addition of long-range TPE currents improved the description of the experimental data.",11,[],11
1104.1308,nucl-th,A model independent theoretical analysis of recent experimental data on deuteron photodisintegration with polarized laser beams is presented. We find that it is important to distinguish between the three isovector E1 amplitudes equation in reaction channels with total angular momentum equation and that the isoscalar M1 amplitude equation is non-zero in the photon energy range equation,11,[],11
1110.6035,physics,"In the present paper we revisit, theoretical and experimentally, the fall of a folded U-chain and of a pile-chain. The model calculation implies the division of the whole system into two subsystems of variable mass, allowing to explore the role of tensional contact forces at the boundary of the subsystems. This justifies, for instance, that the folded U-chain falls faster than the acceleration due to the gravitational force. This result, which matches quite well with the experimental data independently of the type of chain, implies that the falling chain is well described by energy conservation. We verify that these conclusions are not observed for the pile-chain motion.",11,[],5
1105.4997,physics,"We discuss how, in the theoretical scenario presented in [1], the gravity screening and the gravity impulse which seem to be produced under certain conditions by high temperature superconductors are expected to be an entropic response to the flow of part of the system into a deeper quantum regime.",11,[],5
1103.2864,physics,"We theoretically predict efficient optical second-harmonic generation (SHG) from a few hundred nanometer thick slab consisting of a quadratic nonlinear anisotropic medium whose linear principal permittivities are, at the fundamental wavelength, very small and have different signs (indefinite medium). We show that, by illuminating the slab with a p-polarized fundamental wave (with intensity of a few MW/cm2), a highly efficient scattering of the second-harmonic field occurs when the conditions of linear complete slab transparency for the fundamental wave are met. The high efficiency of the SHG process, stems from the large non-plasmonic enhancement of the longitudinal field, perpendicular to the slab surface, produced by the very small value of the slab dielectric permittivities. A suitable nano-structured composite is proposed and numerically designed for observing the novel non-phase-matched and highly efficient SHG process from nano-structures.",11,[],5
1109.6825,physics,"NOequationA is an accelerator-based neutrino oscillation experiment which has a great potential to measure the last unknown mixing angle equation, the neutrino mass hierarchy, and the CP-violation phase in lepton sector with 1) 700 kW beam, 2) 14 mrad off the beam axis, 3) 810 km long baseline. The Near Detector on the Surface is fully functioning and taking both NuMI and Booster beam data. The far detector building achieved beneficial occupancy on April 13. This proceeding will focus on the DAQ software system.",11,['hep-ex'],5
1112.5913,physics,"We analyze the behavior of bursts of neural activity in the Kinouchi-Copelli model, originally conceived to explain information processing issues in sensory systems. We show that, at a critical condition, power-law behavior emerges for the size and duration of the bursts (avalanches), with exponents experimentally observed in real biological systems.",11,['q-bio'],5
1111.3627,physics,"The functioning and efficiency of natural photosynthetic complexes is strongly influenced by their embedding in a noisy protein environment, which can even serve to enhance the transport efficiency. Interactions with the environment induce fluctuations of the transition energies of and interactions between the chlorophyll molecules, and due to the fact that different fluctuations will partially be caused by the same environmental factors, correlations between the various fluctuations will occur. We argue that fluctuations of the interactions should in general not be neglected, as these have a considerable impact on population transfer rates, decoherence rates and the efficiency of photosynthetic complexes. Furthermore, while correlations between transition energy fluctuations have been studied, we provide the first quantitative study of the effect of correlations between interaction fluctuations and transition energy fluctuations, and of correlations between the various interaction fluctuations. It is shown that these additional correlations typically lead to changes in interchromophore transfer rates, population oscillations and can lead to a limited enhancement of the light harvesting efficiency.",11,['quant-ph'],5
1110.6258,physics,"Electromagnetically induced transparency-like behavior in the extreme ultraviolet (XUV) is studied theoretically, including the effect of intense 800 nm laser dressing of He 2s2p (1Po) and 2p2 (1Se) autoionizing states. We present an ab initio solution of the time-dependent Schrodinger equation (TDSE) in an LS-coupling configuration interaction basis set. The method enables a rigorous treatment of optical field ionization of these coupled autoionizing states into the N = 2 continuum in addition to N = 1. Our calculated transient absorption spectra show encouraging agreement with experiment.",11,[],5
1109.1461,physics,"Human beings prefer ordered complexity and not randomness in their environment, a result of our perceptual system evolving to interpret natural forms. We also recognize monotonously repeating forms as unnatural. Although widespread in today's built environment, such forms generate reactions ranging from boredom to unease. Christopher Alexander has introduced rules for generating forms adapted to natural geometries, which show structured variation with multiple symmetries in a hierarchy of scales. It turns out to be impossible to generate monotonously repeating forms by following those rules. As it is highly probable that traditional artifacts, buildings, and cities were created instinctively using a version of the same rules, this is the reason we never find monotonously repeating forms in traditional cultures.",11,[],5
1101.1417,physics,"In this paper we construct a theory of quantum mechanics based on Shannon information theory. We define a few principles regarding information-based frames of reference, including explicitly the concept of information covariance, and show how an ensemble of all possible physical states can be setup on the basis of the accessible information in the local frame of reference. In the next step the Bayesian principle of maximum entropy is utilized in order to constrain the dynamics. We then show, with the aid of Lisi's universal action reservoir approach, that the dynamics is equivalent to that of quantum mechanics. Thereby we show that quantum mechanics emerges when classical physics is subject to incomplete information. We also show that the proposed theory is relational and that it in fact is a path integral version of Rovelli's relational quantum mechanics. Furthermore we give a discussion on the relation between the proposed theory and quantum mechanics, in particular the role of observation and correspondence to classical physics is addressed. In addition to this we derive a general form of entropy associated with the information covariance of the local reference frame. Finally we give a discussion and some open problems.",11,[],5
