id,category,abstract,year,cross_lists,cat_int
1610.09966,hep-th,"We look for long-living topological solutions of classical nonlinear equation dimensional equation field theory. To that effect we use the well-known cut-and-match method. In this framework, new long-living states are obtained in both topological sectors. In particular, in one case a highly excited state of a kink is found. We discover several ways of energy reset. In addition to the expected emission wave packets (with small amplitude), for some selected initial conditions the production of kink-antikink pairs results in a large energy reset. Also, the topological number of a kink in the central region changes in the contrast of saving full topological number. At lower excitation energies there is a long-living excited vibrational state of the kink; this phenomenon is the final stage of all considered initial states. Over time this excited state of the kink changes to a well-known linearized solution - a discrete kink excitation mode. This method yields a qualitatively new way to describe the large-amplitude bion, which was detected earlier in the kink-scattering processes in the nontopological sector.",16,[],4
1605.01732,hep-th,"We study the complex deformations of orientifolds of D3-branes at toric CY singularities, using their description in terms of dimer diagrams. We describe orientifold quotients that have fixed lines or fixed points in the dimer, and characterize the possibilities to deform them in terms of the behaviour of zig-zag paths under the orientifold symmetry. The resulting models are holographic duals to warped throats with orientifold planes. Our systematic construction provides a general class of configurations which includes models recently appeared in the context of de Sitter uplift by nilpotent goldstino or dynamical supersymmetry breaking.",16,[],4
1604.08871,hep-th,"In this work we deal with non-topological solutions of the Q-ball type in two space-time dimensions, in models described by a single complex scalar field that engenders global symmetry. The main novelty is the presence of stable Q-balls solutions that live in a compact interval of the real line and appear from a family of models controlled by two distinct parameters. We find analytical solutions and study their charge and energy, and show how to control the parameters to make the Q-balls classically and quantum mechanically stable.",16,[],4
1608.06452,hep-th,"We consider the equation equation SQCD-like (direct) theory (and its Seiberg's dual with equation dual colors), and with equation flavors of light quarks equation with the mass term in the superpotential equation. Besides, there are equation additional colorless but flavored fields equation with the large mass parameter equation. But now considered is the region equation where the UV free direct equation theory is strongly coupled at scales equation.   The mass spectra of this direct theory in various vacua and at different values of equation are calculated within the dynamical scenario introduced by the author in [10]. This scenario assumes that quarks in such equation SQCD-like theories can be in two standard phases only. These are either the HQ (heavy quark) phase where they are confined or the Higgs phase.   It is shown that due to the strong power-like RG evolution, the seemingly heavy and dynamically irrelevant at scales equation fields equation can become light and relevant at lower energies, and there appear then two additional generation of light equation-particles with masses equation.   The calculated mass spectra of this strongly coupled at equation theory are compared to those of its weakly coupled at equation Seiberg's dual equation variant and appeared to be parametrically different. It is worth to recall that the dynamical scenario from [10] used in this article satisfies all those tests which were used as checks of the Seiberg hypothesis about the equivalence of the direct and dual theories. This parametrical difference shows, in particular, that all these tests, although necessary, may well be insufficient.",16,[],4
1611.02201,hep-th,"We propose a simple and generic holographic equation-function that is defined purely from geometry by using the non-affine expansion for null congruences. We examined the proposal for BPS black solutions in equation gauged supergravity that interpolate between two different dimensional AdS spacetimes and also for domain wall solutions. Moreover, we commented on the relation of this geometric proposal with the one from the holographic entanglement entropy.",16,[],4
1610.04163,hep-th,"Cosmological alpha-attractor models in \cN=1 supergravity are based on hyperbolic geometry of a Poincar\'e disk with the radius square \cal R2=3\alpha. The predictions for the B-modes, r\approx 3\alpha 4\over N2, depend on moduli space geometry and are robust for a rather general class of potentials. Here we notice that starting with M-theory compactified on a 7-manifold with G2 holonomy, with a special choice of Betti numbers, one can obtain d=4 \cN=1 supergravity with rank 7 scalar coset \Big[SL(2)\over SO(2)\Big]7. In a model where these 7 unit size Poincar\'e disks have identified moduli one finds that 3 alpha =7. Assuming that the moduli space geometry of the phenomenological models is inherited from this version of M-theory, one would predict r \approx 10-2 for 53 e-foldings. We also describe the related maximal supergravity and M/string theory models leading to preferred values 3 alpha =1,2,3,4,5,6,7.",16,[],4
1601.01943,hep-th,We study the one loop renormalization group flow of the marginal deformations of N=4 SYM theory using the a-function. We found that in the planar limit some non-supersymmetric deformations flow to the supersymmetric infrared fixed points described by the Leigh-Strassler theory. This means supersymmetry emerges as a result of renormalization group flow.,16,[],4
1602.04221,hep-th,"Compactifications of the physical superstring to two dimensions provide a general template for realizing 2D conformal field theories coupled to worldsheet gravity, i.e. non-critical string theories. Motivated by this observation, in this paper we determine the quasi-topological 8D theory which governs the vacua of 2D N = (0,2) gauged linear sigma models (GLSMs) obtained from compactifications of type I and heterotic strings on a Calabi-Yau fourfold. We also determine the quasi-topological 6D theory governing the 2D vacua of intersecting 7-branes in compactifications of F-theory on an elliptically fibered Calabi-Yau fivefold, where matter fields and interaction terms localize on lower-dimensional subspaces, i.e. defect operators. To cancel anomalies / cancel tadpoles, these GLSMs must couple to additional chiral sectors, which in some cases do not admit a known description in terms of a UV GLSM. Additionally, we find that constructing an anomaly free spectrum can sometimes break supersymmetry due to spacetime filling anti-branes. We also study various canonical examples such as the standard embedding of heterotic strings on a Calabi-Yau fourfold and F-theoretic ""rigid clusters"" with no local deformation moduli of the elliptic fibration.",16,[],4
1607.04195,hep-th,"Chameleon fields are quantum fields with an increasing mass as a function of the matter density of the environment. Recently chameleon fields have been exploited to solve the cosmological constant problem in the Modified Fujii's Model - MFM [Phys Rev D82 (2010) 044006]. However, gravity has been treated basically at a semiclassical level in that paper. In this article the stringy origin of the MFM is further discussed: as we will see, the MFM can be obtained from heterotic-M-theory. Consequently, a quantum description of gravity is obtained and the theory is finite because we choose the string mass as our UV cut-off. This stringy origin of the MFM creates stronger theoretical grounds for our solution to the cosmological constant problem. In our analysis, time will be compactified on a equation orbifold and this peculiar compactification of time has a number of consequences. For example, as we will see, quantum gravity and a quantum gauge theory are actually the same theory in the sense that gravity is the time-evolution of a gauge theory. This might be the key to obtain a non-approximated stabilizing potential for the dilaton in the string frame. In this paper we will further discuss the non-equivalence of different conformal frames at the quantum level. As we will see, in our approach we use basically a unique conformal frame: the frame where the masses of particles are field dependent. A word of caution is necessary: we do not take into account massive string states and IR divergences.",16,[],4
1610.02403,hep-th,"The four-dimensional effective theory for type IIB warped flux compactifications proposed in [1] is completed by taking into account the backreaction of the Kahler moduli on the three-form fluxes. The only required modification consists in a flux-dependent contribution to the chiral fields parametrising the Kahler moduli. The resulting supersymmetric effective theory satisfies the no-scale condition and consistently combines previous partial results present in the literature. Similar results hold for M-theory warped compactifications on Calabi-Yau fourfolds, whose effective field theory and Kahler potential are also discussed.",16,[],4
1607.06379,hep-th,"We consider the conformal higher spin (CHS) theory in d=4 that contains the s=1 Maxwell vector, s=2 Weyl graviton and their higher spin s=3,4,... counterparts with higher-derivative \boxs kinetic terms. The interacting action for such theory can be found as the coefficient of the logarithmically divergent part in the induced action for sources coupled to higher spin currents in a free complex scalar field model. We explicitly determine some cubic and quartic interaction vertices in the CHS action from scalar loop integrals. We then compute the simplest tree-level 4-particle scattering amplitudes 11 -> 11, 22 -> 22 and 11 -> 22 and find that after summing up all the intermediate CHS exchanges they vanish. This generalises the vanishing of the scattering amplitude for external conformal scalars interacting via the exchange of all CHS fields found earlier in arXiv:1512.08896. This vanishing should generalise to all scattering amplitudes in the CHS theory and as in the conformal scalar scattering case should be a consequence of the underlying infinite dimensional higher spin symmetry that extends the standard conformal symmetry.",16,[],4
1606.07070,hep-th,"Twisted sectors arise naturally in the bosonic higher spin CFTs at their free points, as well as in the associated symmetric orbifolds. We identify the coset representations of the twisted sector states using the description of W\infty representations in terms of plane partitions. We confirm these proposals by a microscopic null-vector analysis, and by matching the excitation spectrum of these representations with the orbifold prediction.",16,[],4
1605.06098,hep-th,We revisit AdSequation holography with the Sachdev-Ye-Kitaev models in mind. Our main result is to rewrite a generic theory of gravity near an AdSequation throat as a novel hydrodynamics coupled to the correlation functions of a conformal quantum mechanics. This gives a prescription for the computation of equation-point functions in the dual quantum mechanics. We thereby find that the dual is maximally chaotic.,16,[],4
1605.01075,hep-th,"In this paper we argue that classical, asymptotically AdS spacetimes that arise as states in consistent ultraviolet completions of Einstein gravity coupled to matter must satisfy an infinite family of positive energy conditions. To each ball-shaped spatial region equation of the boundary spacetime, we can associate a bulk spatial region equation between equation and the bulk extremal surface equation with the same boundary as equation. We show that there exists a natural notion of a gravitational energy for every such region that is non-negative, and non-increasing as one makes the region smaller. The results follow from identifying this gravitational energy with a quantum relative entropy in the associated dual CFT state. The positivity and monotonicity properties of the gravitational energy are implied by the positivity and monotonicity of relative entropy, which holds universally in all quantum systems.",16,[],4
1610.02996,hep-th,In BV formalism we can consider a Lagrangian submanifold as a gauge condition. Starting with the BV action functional we construct a closed form on the space of Lagrangian submanifolds. If the action functional is invariant with respect to some group equation and equation is an equation-invariant family of Lagrangian submanifold then under certain conditions we construct a form on equation that descends to a closed form on equation Integrating the latter form over a cycle in equation we obtain numbers that can have interesting physical meaning. We show that one can get string amplitudes this way. Applying this construction to topological quantum field theories one obtains topological invariants.,16,[],4
1603.03382,hep-th,"We discuss fermions in a spontaneously generated holographic lattice background. The lattice structure at the boundary is generated by introducing a higher-derivative interaction term between a U(1) gauge field and a scalar field. We solve the equations of motion below the critical temperature at which the lattice forms, and analyze the change in the Fermi surface due to the lattice. The fermion band structure is found to exhibit a band gap due to lattice effects.",16,[],4
1602.05817,hep-th,"We show that an integrable four-dimensional non-unitary field theory that was recently proposed as a certain limit of the equation-deformed equation SYM theory is incomplete and not conformal -- not even in the planar limit. We complete this theory by double-trace couplings and find conformal one-loop fix-points when admitting respective complex coupling constants. These couplings must not be neglected in the planar limit, as they can contribute to planar multi-point functions. Based on our results for certain two-loop planar anomalous dimensions, we propose tests of integrability.",16,[],4
1612.08115,hep-th,"In this paper we consider equation theory in equation dimensions at the Wilson-Fisher fixed point where the theory becomes conformal. We extend the method in arXiv:1505.00963 for calculating the leading order term in the anomalous dimensions of some operators with spin. This method involves mostly symmetry arguments and reduces the process for calculating anomalous dimensions to some Wick contractions in the corresponding free theory. We apply this method in the case of operators with two and three fields whose twist is equal to the number of fields they contain, and we rederive known results for their anomalous dimensions. We also calculate the leading term in the anomalous dimensions of operators with spin two and three. In addition, we find expressions for the primary operators of the free theory, for arbitrary spin and number of fields, whose twist remains equal to the number of fields.",16,[],4
1612.07785,hep-th,"Global conformal invariance determines the form of two and three-point functions of quasi-primary operators in a conformal field theory, and generates nontrivial relations between terms in the operator product expansion. These ideas are generalized to the principal and complementary series representations, which play an important role in the conjectured dS/CFT correspondence. The conformal partial wave expansions are constructed for these representations which in turn determine the operator product expansion. This leads us to conclude that conformal field theories containing such representations have essential singularities, so cannot be realized as conventional field theories.",16,[],4
1610.04453,hep-th,"In this note, we study the equation-cut representation by combining it with BCFW deformation. As a consequence, the one-loop integrand is expressed in terms of a recursion relation, i.e., equation-point one-loop integrand is constructed using tree-level amplitudes and equation-point one-loop integrands with equation. By giving explicit examples, we show that the integrand from the recursion relation is equivalent to that from Feynman diagrams or the original equation-cut construction, up to scale free terms.",16,[],4
1602.06517,hep-th,"String theory axions are interesting candidates for fields whose potential might be controllable over super-Planckian field ranges and therefore as possible candidates for inflatons in large field inflation. Axion monodromy scenarios are setups where the axion shift symmetry is broken by some effect such that the axion can traverse a large number of periods potentially leading to super-Planckian excursions. We study such scenarios in type IIA string theory where the axion shift symmetry is broken by background fluxes. In particular we calculate the backreaction of the energy density induced by the axion vacuum expectation value on its own field space metric. We find universal behaviour for all the compactifications studied where up to a certain critical axion value there is only a small backreaction effect. Beyond the critical value the backreaction is strong and implies that the proper field distance as measured by the backreacted metric increases at best logarithmically with the axion vev, thereby placing strong limitations on extending the field distance any further. The critical axion value can be made arbitrarily large by the choice of fluxes. However the backreaction of these fluxes on the axion field space metric ensures a precise cancellation such that the proper field distance up to the critical axion value is flux independent and remains sub-Planckian. We also study an axion alignment scenario for type IIA compactifications on a twisted torus with four fundamental axions mixing to leave an axion with an effective decay constant which is flux dependent. There is a choice of fluxes for which the alignment parameter is unconstrained by tadpoles and can in principle lead to a parametrically enhanced effective decay constant. However we show that these fluxes backreact on the fundamental decay constants so as to precisely cancel any enhancement.",16,[],4
1609.05039,hep-th,"We analyse the most general bosonic supersymmetric solutions of type IIB supergravity whose metrics are warped products of five-dimensional anti-de Sitter space (AdSequation) with a five-dimensional Riemannian manifold equation, where the five-form flux vanishes, while all remaining fluxes are allowed to be non-vanishing consistent with SO(4,2) symmetry. This completes the program of classifying all supersymmetric solutions of ten and eleven-dimensional supergravity with an AdSequation factor. We investigate the supersymmetry conditions in some special cases, and demonstrate how these are satisfied by a solution originally found in arXiv:1410.2650[hep-th], utilising the method of non-Abelian T-duality.",16,[],4
1602.07177,hep-th,"In any gravitational theory and in a wide class of background space-times, we argue that there exists a simple, yet profound, relation between the on-shell Euclidean gravitational action and the on-shell Euclidean action of probes. The probes can be, for instance, charged particles or branes. The relation is tightly related to the thermodynamic nature of gravity. We provide precise checks of the relation in several examples, which include both asymptotically flat and asymptotically AdS space-times, with particle, D-brane and M-brane probes. Perfect consistency is found in all cases, including in a highly non-trivial example including \alpha'-corrections.",16,[],4
1607.06643,hep-th,"Integrable structure has played a very important role in the study of various non-perturbative aspects of planar ABJM theories. In this paper we showed that this remarkable structure survive after orbifold operation with discrete group equation. For general equation, we prove the integrability in the scalar sector at the planar two-loop order and get the Bethe ansatz equations. The eigenvalues of the anomalous dimension matrix are also obtained. For equation, two-loop all-sector and all-loop BAEs are proposed. Supersymmetric orbifolds are discussed in this framework.",16,[],4
1604.06025,hep-th,"The gauge invariance analysis of theories described in noncommutative (NC) space-times can lead us to interesting results since noncommutativity is one of the possible paths to investigate quantum effects in classical theories such as general relativity, for example. This theoretical possibility has motivated us to analyze the gauge invariance of the NC version of the Proca model, which is a second-class system, in Dirac's classification, since its classical formulation (commutative space-time) has its gauge invariance broken thanks to the mass term. To obtain such gauge invariant model, we have used the gauge unfixing method to construct a first-class NC version of the Proca model. We have also questioned if the gauge symmetries of NC theories, are affected necessarily or not by the NC parameter. In this way, we have calculated its respective symmetries in a standard way via Poisson brackets.",16,[],4
1611.10255,hep-th,"We describe an application of the Monte Carlo method to the Janus deformation of the black brane background. We present numerical results for three and five dimensional black Janus geometries with planar and spherical interfaces. In particular, we argue that the 5D geometry with a spherical interface has an application in understanding the finite temperature bag-like QCD model via the AdS/CFT correspondence. The accuracy and convergence of the algorithm are evaluated with respect to the grid spacing. The systematic errors of the method are determined using an exact solution of 3D black Janus. This numerical approach for solving linear problems is unaffected initial guess of a trial solution and can handle an arbitrary geometry under various boundary conditions in the presence of source fields.",16,[],4
1609.04550,hep-th,"Entropy is a quantity for counting physical degrees of freedom in a system. At a finite temperature, one can use thermal entropy to study thermodynamical properties. At zero temperature, entanglement entropy is expected to provide a suitable order parameter of a phase structure. Especially, the entanglement entropy exhibits an interesting codimension two area law in a strongly coupled conformal field theory. We compute thermal entropy in a non-relativistic model with an infinite fermion mass limit from an exact effective potential to obtain thermal entropy at an infinite strong coupling limit. The computational result provides vanishing thermal entropy at an infinite strong coupling limit with a finite lattice spacing. The non-trivial topological term can be included in the strongly coupled lattice system to obtain the non-trivial entropy and the topology can be marked from the entropy. We first compute the thermal entropy in a two dimensional lattice topological quantum field theory to study the lattice artifact and also argue that a theory possibly has translational invariance if a system does not have a volume law in the entanglement entropy. Finally, we show that a coefficient of a universal term of the entanglement entropy should not be affected by a choice of an entangling surface in two dimensional conformal field theory for one interval case. We also discuss a choice of the entangling surface in the entanglement entropy in two dimensional equation model at the large equation limit.",16,[],4
1603.02085,hep-th,"It is well known that perturbative pressure calculations show poor convergence. Calculations using a two particle irreducible (2PI) effective action show improved convergence at the 3 loop level, but no calculations have been done at 4 loops. We consider the 2PI effective theory for a symmetric scalar theory with quartic coupling in 4-dimensions. We calculate the pressure and two different non-perturbative vertices as functions of coupling and temperature. Our results show that the 4 loop contribution can become larger than the 3 loop term when the coupling is large. This indicates a breakdown of the 2PI approach, and the need for higher order equationPI approximations. In addition, our results demonstrate the renormalizability of 2PI calculations at the 4 loop level. This is interesting because the counterterm structure of the 2PI theory at 4 loops is different from the structure at equation loops. Two vertex counterterms are required at the 4 loop level, but not at lower loop order. This unique feature of the 2PI theory has not previously been verified numerically.",16,[],4
