id,category,abstract,year,cross_lists,cat_int
1211.3862,astro-ph,"We study the evolution of the Earth collision probability of asteroid 2008 TC3 using a short observational arc and small numbers of observations. To assess impact probability, we use techniques that rely on the orbital-element probability density function characterized using both Markov-chain Monte-Carlo orbital ranging and Monte-Carlo ranging. First, we evaluate the orbital uncertainties for the object from the night of discovery onwards and examine the collapse of the orbital-element distributions in time. Second, we examine the sensitivity of the results to the assumed astrometric noise. Each of the orbits obtained from the MCMC ranging method is propagated into the future (within chosen time bounds of the expected impact), and the collision probability is calculated as a weighted fraction of the orbits leading to a collision from the Earth. We compare the results obtained with both methods.",12,[],1
1203.0344,astro-ph,"From H\alpha narrow band observations, we identified three H\alpha emitting regions in the direction of Magellanic Stream IV (MS IV). They consist of three parallel filaments with 2 arcmin width and 6 -- 30 arcmin length at 12 arcmin intervals. The mean surface brightness of them is equation erg sequation cmequation arcsecequation. Because of their low surface brightness, the regions were not detected in previous H\alpha surveys. In HI map, the position of the filaments overlap MS, suggesting that they are parts of MS, but there also exists a local HI structure. If the filaments associate with MS, the sizes are 30 pc equation 100 -- 500 pc. The filaments lie at the leading edge of a downstream cloud, which supports a shock heating and its propagation (shock cascade) model for the ionizing source. If they are local objects, on the other hand, Fossil Stromgren Trails of more than two stars is a possible interpretation, and the sizes would be 0.1 pc equation 0.3 -- 1.5 pc at 180 pc distance. The positional information of the H\alpha filaments presented in this letter enables us future spectroscopic observations to clarify their nature.",12,[],1
1204.6359,astro-ph,"Time delay in galaxy gravitational lensing systems has been used to determine the value of Hubble constant. As in other dynamical phenomena at the scale of galaxy, dark matter is often invoked in gravitational lensing to account for the ""missing mass"" (the apparent discrepancy between the dynamical mass and the luminous mass). Alternatively, modified gravity can be used to explain the discrepancy. In this paper we adopt the Tensor-Vector-Scalar gravity (TeVeS), a relativistic version of MOdified Newtonian Dynamics (MOND), to study gravitational lensing phenomena and derive the formulae needed to evaluate the Hubble constant. We test our method on quasar lensing by elliptical galaxies in the literature. We focus on double-image systems with time delay measurement. Three candidates are suitable for our study: HE 2149-2745, FBQ J09512635 and SBS 0909532. The Hubble constant obtained is consistent with the value used in fitting the CMB result in neutrino cosmological model.",12,[],1
1210.4827,astro-ph,"Via joint analysis of a calibrated telescopic survey, which found scattering Kuiper Belt objects, and models of their expected orbital distribution, we measure the form of the scattering object's size distribution. Ruling out a single power-law at greater than 99% confidence, we constrain the form of the size distribution and find that, surprisingly, our analysis favours a very sudden decrease (a divot) in the number distribution as diameters decrease below 100 km, with the number of smaller objects then rising again as expected via collisional equilibrium. Extrapolating at this collisional equilibrium slope produced enough kilometer-scale scattering objects to supply the nearby Jupiter-Family comets. Our interpretation is that this divot feature is a preserved relic of the size distribution made by planetesimal formation, now ""frozen in"" to portions of the Kuiper Belt sharing a ""hot"" orbital inclination distribution, explaining several puzzles in Kuiper Belt science. Additionally, we show that to match today's scattering-object inclination distribution, the supply source that was scattered outward must have already been vertically heated to of order 10 degrees.",12,[],1
1210.1641,astro-ph,"In the era of precision cosmology the Virgo cluster takes on a new role in the cosmic distance scale. Its traditional role of testing the consistency of secondary distance indicators is replaced by an ensemble of distance measurements within the Local Supercluster united by a velocity field model obtained from redshift survey based reconstruction. WMAP leads us to see the Hubble Constant as one of six parameters in a standard model of cosmology with considerable covariance between parameters. Independent experiments, such as WMAP and the HST Key Project (and their successors) constrain these parameters.",12,[],1
1209.3858,astro-ph,"We have developed a multi-pixel beamformer technique, which can be used for enhancing the capabilities for studying pulsars using an interferometric array. Using the Giant Metrewave Radio Telescope (GMRT), we illustrate the application of this efficient technique, which combines the enhanced sensitivity of a coherent array beamformer with the wide field-of-view seen by an incoherent array beamformer. Multi-pixel beamformer algorithm is implemented using the recorded base-band data. With the optimisations in multi-pixelisation described in this paper, it is now possible to form 16 directed beams in real-time. We discuss a special application of this technique, where we use continuum imaging followed by the multi-pixel beamformer to obtain the precise locations of newly discovered millisecond pulsars with the GMRT. Accurate positions measured with single observations enable highly sensitive follow-up studies using coherent array beamformer and rapid follow up at higher radio frequencies and other wavelengths. Normally, such accurate positions can only be obtained from a long-term pulsar timing program. The multi-pixel beamformer technique can also be used for highly sensitive targeted pulsar searches in extended supernova remnants. In addition this method can provide optimal performance for the large scale pulsar surveys using multi-element arrays.",12,[],1
1204.0310,astro-ph,"We show that an upper limit on the maximum brightness temperature for a self-absorbed incoherent synchrotron radio source is obtained from the size of its gyro orbits, which in turn must lie well within the confines of the total source extent. These temperature limits are obtained without recourse to inverse Compton effects or the condition of equipartition of energy between magnetic fields and relativistic particles. For radio variables, the intra-day variability (IDV) implies brightness temperatures equation K in the co-moving rest frame of the source. This, if interpreted purely due to an incoherent synchrotron emission, would imply gyro radii equation cm, the size of the universe, while from the causality arguments the inferred maximum size of the source in such a case is equation cm. Such high brightness temperatures are sometimes modeled in the literature as some coherent emission process where bunches of non-thermal particles are somehow formed that radiate in phase. We show that, unlike in case of curvature radiation models proposed in pulsars, in the synchrotron radiation mechanism the oppositely charged particles would contribute together to the coherent phenomenon without the need to form separate bunches of the opposite charges. At the same time we show that bunches would disperse over dimensions larger than a wavelength in time shorter than the gyro orbital period (equation sec). Therefore a coherent emission by bunches cannot be a plausible explanation of the high brightness temperatures inferred in extragalactic radio sources showing variability over a few hours or longer.",12,[],1
1209.1898,astro-ph,"Collapse and fragmentation of primordial filamentary clouds under isotropic dissociation radiation is investigated with one-dimensional hydrodynamical calculations. We investigate the effect of dissociation photon on the filamentary clouds with calculating non-equilibrium chemical reactions. With the external radiation assumed to turn on when the filamentary cloud forms, the filamentary cloud with low initial density (equation) suffers photodissociation of hydrogen molecules. In such a case, since main coolant is lost, temperature increases adiabatically enough to suppress collapse. As a result, the filamentary cloud fragments into very massive clouds (equation). On the other hand, the evolution of the filamentary clouds with high initial density (equation) is hardly affected by the external radiation. This is because the filamentary cloud with high initial density shields itself from the external radiation. It is found that the external radiation increases fragment mass. This result is consistent with previous results with one-zone models. It is also found that fragment mass decreases owing to the external dissociation radiation in the case with sufficiently large line mass.",12,[],1
1206.1177,astro-ph,"We report the discovery of WASP-78b and WASP-79b, two highly-bloated Jupiter-mass exoplanets orbiting F-type host stars. WASP-78b orbits its V=12.0 host star (TYC 5889-271-1) every 2.175 days and WASP-79b orbits its V=10.1 host star (CD-30 1812) every 3.662 days. Planetary parameters have been determined using a simultaneous fit to WASP and TRAPPIST transit photometry and CORALIE radial-velocity measurements. For WASP-78b a planetary mass of 0.89 /- 0.08 MJup and a radius of 1.70 /- 0.11 RJup is found. The planetary equilibrium temperature of TP = 2350 /- 80 K for WASP-78b makes it one of the hottest of the currently known exoplanets. WASP-79b its found to have a planetary mass of 0.90 /- 0.08 MJup, but with a somewhat uncertain radius due to lack of sufficient TRAPPIST photometry. The planetary radius is at least 1.70 /- 0.11 RJup, but could be as large as 2.09 /- 0.14 RJup, which would make WASP-79b the largest known exoplanet.",12,[],1
1210.0318,astro-ph,"We review the current status of studies of disc atmospheres and winds in low mass X-ray binaries. We discuss the possible wind launching mechanisms and compare the predictions of the models with the existent observations. We conclude that a combination of thermal and radiative pressure (the latter being relevant at high luminosities) can explain the current observations of atmospheres and winds in both neutron star and black hole binaries. Moreover, these winds and atmospheres could contribute significantly to the broad iron emission line observed in these systems.",12,[],1
1203.3582,astro-ph,"GRS 1915105 is a widely studied black hole binary, well known because of its extremely fast and complex variability. Flaring periods of high variability alternate with ""stable"" phases (the plateaux) when the flux is low, the spectra are hard and the timing properties of the source are similar to those of a number of black hole candidates in hard spectral state. In the plateaux the power density spectra are dominated by a low frequency quasi periodic oscillation (LFQPO) superposed onto a band limited noise continuum and accompanied by at least one harmonic. In this paper we focus on three plateaux, presenting the analysis of the power density spectra and in particular of the LFQPO and its harmonics. While plotting the LFQPO and all the harmonics together on a frequency-width plane, we found the presence of a positive trend of broadening when the frequency increases. This trend can shed light in the nature of the harmonic content of the LFQPO and challenges the usual interpretation of these timing features.",12,[],1
1207.6223,astro-ph,"We review the evidence behind recent claims of spatial variation in the fine structure constant deriving from observations of ionic absorption lines in the light from distant quasars. To this end we expand upon previous non-Bayesian analyses limited by the assumptions of an unbiased and strictly Normal distribution for the ""unexplained errors"" of the benchmark quasar dataset. Through the technique of reverse logistic regression we estimate and compare marginal likelihoods for three competing hypotheses---(i) the null hypothesis (no cosmic variation), (ii) the monopole hypothesis (a constant Earth-to-quasar offset), and (iii) the monopoledipole hypothesis (a cosmic variation manifest to the Earth-bound observer as a North-South divergence)---under a variety of candidate parametric forms for the unexplained error term. Our analysis reveals weak support for a skeptical interpretation in which the apparent dipole effect is driven solely by systematic errors of opposing sign inherent in measurements from the two telescopes employed to obtain these observations. Throughout we seek to exemplify a 'best practice' approach to Bayesian model selection with prior-sensitivity analysis; in a companion paper we extend this methodology to a semi-parametric framework using the infinite-dimensional Dirichlet process.",12,[],1
1202.4461,astro-ph,"The evolutionary properties of the old metal-rich Galactic open cluster NGC6791 are assessed, based on deep UB photometry and 2Mass JK data. For 4739 stars in the cluster, bolometric luminosity and effective temperature have been derived from theoretical (U-B) and (J-K) color fitting. The derived H-R diagram has been matched with the UVBLUE grid of synthetic stellar spectra to obtain the integrated SED of the system, together with a full set UV (Fanelli) and optical (Lick) narrow-band indices. The cluster appears to be a fairly good proxy of standard elliptical galaxies, although with significantly bluer infrared colors, a shallower 4000A Balmer break, and a lower Mg2 index. The confirmed presence of a dozen hot stars, along their EHB evolution, leads the cluster SED to consistently match the properties of the most active UV-upturn galaxies, with 1.7/-0.4% of the total bolometric luminosity emitted shortward of 2500A.   The cluster Helium abundance results Y=0.30 /-0.04, while the Post-MS implied stellar lifetime from star number counts fairly agrees with the theoretical expectations from both the Padova and BASTI stellar tracks. A Post-MS fuel consumption of 0.43 /- 0.01 Msun is found for NGC6791 stars, in close agreement with the estimated mass of cluster He-rich white dwarfs. Such a tight figure may lead to suspect that a fraction of the cluster stellar population does actually not reach the minimum mass required to effectively ignite He in the stellar core.",12,[],1
1210.3067,astro-ph,"While clusters of galaxies are considered one of the most important cosmological probes, the standard spherical modelling of the dark matter and the intracluster medium is only a rough approximation. Indeed, it is well established both theoretically and observationally that galaxy clusters are much better approximated as triaxial objects. However, investigating the asphericity of galaxy clusters is still in its infancy. We review here this topic which is currently gathering a growing interest from the cluster community. We begin by introducing the triaxial geometry. Then we discuss the topic of deprojection and demonstrate the need for combining different probes of the cluster's potential. We discuss the different works that have been addressing these issues. We present a general parametric framework intended to simultaneously fit complementary data sets (X-ray, Sunyaev Zel'dovich and lensing data). We discuss in details the case of Abell 1689 to show how different models/data sets lead to different haloe parameters. We present the results obtained from fitting a 3D NFW model to X-ray, SZ, and lensing data for 4 strong lensing clusters. We argue that a triaxial model generally allows to lower the inferred value of the concentration parameter compared to a spherical analysis. This may alleviate tensions regarding, e.g. the over-concentration problem. However, we stress that predictions from numerical simulations rely on a spherical analysis of triaxial halos. Given that triaxial analysis will have a growing importance in the observational side, we advocate the need for simulations to be analysed in the very same way, allowing reliable and meaningful comparisons. Besides, methods intended to derive the three dimensional shape of galaxy clusters should be extensively tested on simulated multi-wavelength observations.",12,[],1
1203.4787,astro-ph,"We have carried out an analysis of the HST STIS archival spectra of the magnetic white dwarf in the Hyades eclipsing-spectroscopic, post-common envelope binary V471 Tauri, time resolved on the orbit and on the X-ray rotational phase of the magnetic white dwarf. An HST STIS spectrum obtained during primary eclipse reveals a host of transition region/chromospheric emission features including N V (1238, 1242), Si IV (1393, 1402), C IV (1548, 1550) and He II (1640). The spectroscopic characteristics and emission line fluxes of the transition region/chromosphere of the very active, rapidly rotating, K2V component of V471 Tauri, are compared with the emission characteristics of fast rotating K dwarfs in young open clusters. We have detected a number of absorption features associated with metals accreted onto the photosphere of the magnetic white dwarf from which we derive radial velocities. All of the absorption features are modulated on the 555s rotation period of the white dwarf with maximum line strength at rotational phase 0.0 when the primary magnetic accretion region is facing the observer. The photospheric absorption features show no clear evidence of Zeeman splitting and no evidence of a correlation between their variations in strength and orbital phase. We report clear evidence of a secondary accretion pole. We derive C and Si abundances from the Si IV and C III features. All other absorption lines are either interstellar or associated with a region above the white dwarf and/or with coronal mass ejection events illuminated as they pass in front of the white dwarf.",12,[],1
1206.4585,astro-ph,"Steady accretion of a radiating gas onto a central mass point is described and compared to classic Bondi accretion. Radiation losses are essential for accretion flows to be observed. Unlike Bondi flows, radiating Bondi flows pass through a sonic point at a finite radius and become supersonic near the center. The morphology of all radiating Bondi flows is described by a single dimensionless parameter. In radiating Bondi flows the mass accretion rate varies approximately as the first power of the central mass -- this differs significantly from the quadratic dependence on the central mass in classical Bondi flows. Mass accretion rates onto galaxy or cluster-centered black holes estimated from traditional and radiating Bondi flows are significantly different. In radiating Bondi flows the gas temperature increases at large radii, as in the cores of many galaxy groups and clusters, allowing radiating Bondi flows to merge naturally with gas arriving from their cluster environments. Some radiating flows cool completely before reaching the center of the flow, and this also occurs in cooling site flows in which there is no central gravitating mass.",12,[],1
1211.7266,astro-ph,"Among dozens young pulsar wind nebulae, some have been detected in TeV letter-rays (TeV PWNe), while others have not (non-TeV PWNe). The TeV emission detectability is not correlated either with the spin-down power or with the characteristic age of their central pulsars, and it is an open problem what determines the detectability. To study this problem, we investigate spectral evolution of five young non-TeV PWNe, 3C58, G310.6-1.6, G292.01.8, G11.2-0.3 and SNR B0540-69.3. We use a spectral evolution model which has been developed to be applied to young TeV PWNe in our previous works. TeV letter-ray flux upper limits of non-TeV PWNe give upper or lower limits on parameters, such as the age of the PWN and the fraction of the spin-down power going to the magnetic energy injection (the fraction parameter). Combined with other independent observational and theoretical studies, we can guess a plausible value of the parameters for each object. For 3C58, we prefer the parameters with an age of 2.5 kyr old and the fraction parameter of 3.0x10-3, although the spectral modeling alone does not rule out a shorter age and a higher fraction parameter. The fraction parameter of 3.0x10-3 is also consistent for other non-TeV PWNe and then the value is regarded as common to young PWNe including TeV PWNe. Moreover, we find that the intrinsic properties of the central pulsars are similar, 1048-50erg for the initial rotational energy and 1042-44erg for the magnetic energy (2x1012 - 3x1013G for the dipole magnetic field strength at their surfaces). The TeV detectability is correlated with the total injected energy and the energy density of the interstellar radiation field around PWNe. Except for G292.01.8, a broken power-law injection of the particles well reproduces the broadband emission from non-TeV PWNe.",12,[],1
1207.2160,astro-ph,"We provide new constraints on the connection between galaxies in the local universe, identified by the Sloan Digital Sky Survey (SDSS), and dark matter halos and their constituent substructures in the equationCDM model using WMAP7 cosmological parameters. Predictions for the abundance and clustering properties of dark matter halos, and the relationship between dark matter hosts and substructures, are based on a high-resolution cosmological simulation, the Bolshoi simulation. We associate galaxies with halos and subhalos using subhalo abundance matching, performing a comprehensive analysis which investigates the underlying assumptions of this technique including (a) which halo property is most closely associated with galaxy stellar masses and luminosities, (b) how much scatter is in this relationship, and (c) how much subhalos can be stripped before their galaxies are destroyed. The models are jointly constrained by new measurements of the projected two-point galaxy clustering and the observed conditional stellar mass function of galaxies in groups. The data put tight constraints on the satellite fraction of galaxies as a function of galaxy stellar mass, on the scatter between halo and galaxy properties, and on the underlying conditional stellar mass function. These data rule out several halo properties commonly used in abundance matching, largely because the satellite fractions in the models disagree with those data. We show that an abundance matching model that associates galaxies with the peak circular velocity of their halos is in good agreement with the data, when scatter of equation dex in stellar mass at a given peak velocity is included. This will yield important constraints for galaxy formation models, and also provides encouraging indications that the galaxy--halo connection can be modeled with sufficient fidelity for future precision studies of the dark Universe.",12,[],1
1209.5580,astro-ph,"Observational growth rate data had been derived from observations of redshift distortions in galaxy redshift surveys. Here we use the growth rate data to place constraints on the dark energy model parameters. By performing a joint analysis with the Type Ia supernova, baryon acoustic oscillation and cosmic microwave background data, it is found that the growth rate data are useful for improving the constraints. The joint constraints show that the equationCDM model is still in good agreement with current observations, although a time-variant dark energy still cannot be ruled out. It is argued that the growth rate data are helpful for understanding the dark energy. With more accurate data available in the future, we will have a powerful tool for constraining the cosmological and dark energy parameters.",12,[],1
1211.2232,astro-ph,"We develop and demonstrate an acceleration of the Liu & Tegmark quadratic estimator formalism for inverse variance foreground subtraction and power spectrum estimation in 21 cm tomography from O(N3) to O(N log N), where N is the number of voxels of data. This technique makes feasible the megavoxel scale analysis necessary for current and upcoming radio interferometers by making only moderately restrictive assumptions about foreground models and survey geometry. We exploit iterative and Monte Carlo techniques and the symmetries of the foreground covariance matrices to quickly estimate the 21 cm brightness temperature power spectrum, P(kparallel, kperpendicular), the Fisher information matrix, the error bars, the window functions, and the bias. We also extend the Liu & Tegmark foreground model to include bright point sources with known positions in a way that scales as O[(N log N)(N point sources)] < O(N5/3). As a first application of our method, we forecast error bars and window functions for the upcoming 128-tile deployment of the Murchinson Widefield Array, showing that 1000 hours of observation should prove sufficiently sensitive to detect the power spectrum signal from the Epoch of Reionization.",12,[],1
