id,category,abstract,year,cross_lists,cat_int
1108.6239,cs,"In this paper we discuss a novel data compression technique for binary symmetric sources based on the cavity method over a Galois Field of order q (GF(q)). We present a scheme of low complexity and near optimal empirical performance. The compression step is based on a reduction of sparse low density parity check codes over GF(q) and is done through the so called reinforced belief-propagation equations. These reduced codes appear to have a non-trivial geometrical modification of the space of codewords which makes such compression computationally feasible. The computational complexity is O(d.n.q.log(q)) per iteration, where d is the average degree of the check nodes and n is the number of bits. For our code ensemble, decompression can be done in a time linear in the code's length by a simple leaf-removal algorithm.",11,"['cond-mat', 'math']",7
1110.6231,cs,In our work we present two parallel algorithms and their lock-free implementations using a popular GPU environment Nvidia CUDA. The first algorithm is the push-relabel method for the flow problem in grid graphs. The second is the cost scaling algorithm for the assignment problem in complete bipartite graphs.,11,[],7
1102.3126,cs,"An alternative method for collaborative decoding of interleaved Reed-Solomon codes as well as Gabidulin codes for the case of high interleaving degree is proposed. As an example of application, simulation results are presented for a concatenated coding scheme using polar codes as inner codes.",11,['math'],7
1107.2003,cs,"Data races can significantly affect the executions of multi-threaded programs. Hence, one has to recur the results of data races to deterministically replay a multi-threaded program. However, data races are concealed in enormous number of memory operations in a program. Due to the difficulty of accurately identifying data races, previous multi-threaded deterministic record/replay schemes for commodity multi-processor system give up to record data races directly. Consequently, they either record all shared memory operations, which brings remarkable slowdown to the production run, or record the synchronization only, which introduces significant efforts to replay.   Inspired by the advances in data race detection, we propose an efficient software-only deterministic replay scheme for commodity multi-processor systems, which is named RacX. The key insight of RacX is as follows: although it is NP-hard to accurately identify the existence of data races between a pair of memory operations, we can find out all potential data races in a multi-threaded program, in which the false positives can be reduced to a small amount with our automatic false positive reduction techniques. As a result, RacX can efficiently monitor all potential data races to deterministically replay a multi-threaded program.   To evaluate RacX, we have carried out experiments over a number of well-known multi-threaded programs from SPLASH-2 benchmark suite and large-scale commercial programs. RacX can precisely recur production runs of these programs with value determinism. Averagely, RacX causes only about 1.21%, 1.89%, 2.20%, and 8.41% slowdown to the original run during recording (for 2-, 4-, 8- and 16-thread programs, respectively). The soundness, efficiency, scalability, and portability of RacX well demonstrate its superiority.",11,[],7
1102.3093,cs,"In automata theory, the quantum computation has been widely examined for finite state machines, known as quantum finite automata (QFAs), and less attention has been given to the QFAs augmented with counters or stacks. Moreover, to our knowledge, there is no result related to QFAs having more than one input head. In this paper, we focus on such generalizations of QFAs whose input head(s) operate(s) in one-way or realtime mode and present many superiority of them to their classical counterparts. Furthermore, we propose some open problems and conjectures in order to investigate the power of quantumness better. We also give some new results on classical computation.",11,['quant-ph'],7
1111.3281,cs,"A prototype system for the transliteration of diacritics-less Arabic manuscripts at the sub-word or part of Arabic word (PAW) level is developed. The system is able to read sub-words of the input manuscript using a set of skeleton-based features. A variation of the system is also developed which reads archigraphemic Arabic manuscripts, which are dot-less, into archigraphemes transliteration. In order to reduce the complexity of the original highly multiclass problem of sub-word recognition, it is redefined into a set of binary descriptor classifiers. The outputs of trained binary classifiers are combined to generate the sequence of sub-word letters. SVMs are used to learn the binary classifiers. Two specific Arabic databases have been developed to train and test the system. One of them is a database of the Naskh style. The initial results are promising. The systems could be trained on other scripts found in Arabic manuscripts.",11,[],7
1105.5806,cs,"Ben-Sasson and Sudan (RSA 2006) showed that repeated tensor products of linear codes with a very large distance are locally testable. Due to the requirement of a very large distance the associated tensor products could be applied only over sufficiently large fields. Then Meir (SICOMP 2009) used this result (as a black box) to present a combinatorial construction of locally testable codes that match best known parameters. As a consequence, this construction was obtained over sufficiently large fields.   In this paper we improve the result of Ben-Sasson and Sudan and show that for \emphany linear codes the associated tensor products are locally testable. Consequently, the construction of Meir can be taken over any field, including the binary field.   Moreover, a combination of our result with the result of Spielman (IEEE IT, 1996) implies a construction of linear codes (over any field) that combine the following properties: have constant rate and constant relative distance; have blocklength equation and testable with equation queries, for any constant equation; linear time encodable and linear-time decodable from a constant fraction of errors.   Furthermore, a combination of our result with the result of Guruswami et al. (STOC 2009) implies a similar corollary regarding the list-decodable codes.",11,[],7
1111.3334,cs,"Data inconsistencies are present in the data collected over a large wireless sensor network (WSN), usually deployed for any kind of monitoring applications. Before passing this data to some WSN applications for decision making, it is necessary to ensure that the data received are clean and accurate. In this paper, we have used a statistical tool to examine the past data to fit in a highly sophisticated prediction model i.e., ARIMA for a given sensor node and with this, the model corrects the data using forecast value if any data anomaly exists there. Another scheme is also proposed for detecting data anomaly at sink among the aggregated data in the data are received from a particular sensor node. The effectiveness of our methods are validated by data collected over a real WSN application consisting of Crossbow IRIS Motes \citeCrossbow:2009.",11,[],7
1103.3420,cs,One of the first step in the realization of an automatic system of check recognition is the extraction of the handwritten area. We propose in this paper an hybrid method to extract these areas. This method is based on digit recognition by Fourier descriptors and different steps of colored image processing . It requires the bank recognition of its code which is located in the check marking band as well as the handwritten color recognition by the method of difference of histograms. The areas extraction is then carried out by the use of some mathematical morphology tools.,11,[],7
1105.1364,cs,"There may be sensitive information in a relational database, and we might want to keep it hidden from a user or group thereof. In this work, sensitive data is characterized as the contents of a set of secrecy views. For a user without permission to access that sensitive data, the database instance he queries is updated to make the contents of the views empty or contain only tuples with null values. In particular, if this user poses a query about any of these views, no meaningful information is returned. Since the database is not expected to be physically changed to produce this result, the updates are only virtual. And also minimal in a precise way. These minimal updates are reflected in the secrecy view contents, and also in the fact that query answers, while being privacy preserving, are also maximally informative. Virtual updates are based on the use of null values as used in the SQL standard. We provide the semantics of secrecy views and the virtual updates. The different ways in which the underlying database is virtually updated are specified as the models of a logic program with stable model semantics. The program becomes the basis for the computation of the ""secret answers"" to queries, i.e. those that do not reveal the sensitive information.",11,[],7
1107.2869,cs,"We study \emphcombinatorial procurement auctions, where a buyer with a valuation function equation and budget equation wishes to buy a set of items. Each item equation has a cost equation and the buyer is interested in a set equation that maximizes equation subject to equation. Special cases of combinatorial procurement auctions are classical problems from submodular optimization. In particular, when the costs are all equal (\emphcardinality constraint), a classic result by Nemhauser et al shows that the greedy algorithm provides an equation approximation.   Motivated by many papers that utilize demand queries to elicit the preferences of agents in economic settings, we develop algorithms that guarantee improved approximation ratios in the presence of demand oracles. We are able to break the equation barrier: we present algorithms that use only polynomially many demand queries and have approximation ratios of equation for the general problem and equation for maximization subject to a cardinality constraint.   We also consider the more general class of subadditive valuations. We present algorithms that obtain an approximation ratio of equation for the general problem and 2 for maximization subject to a cardinality constraint. We guarantee these approximation ratios even when the valuations are non-monotone. We show that these ratios are essentially optimal, in the sense that for any constant equation, obtaining an approximation ratio of equation requires exponentially many demand queries.",11,[],7
1107.5242,cs,"Logic programming is a powerful paradigm for programming autonomous agents in dynamic domains, as witnessed by languages such as Golog and Flux. In this work we present ALPprolog, an expressive, yet efficient, logic programming language for the online control of agents that have to reason about incomplete information and sensing actions.",11,[],7
1104.2818,cs,"Let F be a CNF formula with n variables and m clauses. F is 3-satisfiable if for any 3 clauses in F, there is a truth assignment which satisfies all of them. Lieberherr and Specker (1982) and, later, Yannakakis (1994) proved that in each 3-satisfiable CNF formula at least 2/3 of its clauses can be satisfied by a truth assignment. We improve this result by showing that every 3-satisfiable CNF formula F contains a subset of variables U, such that some truth assignment equation will satisfy at least equation clauses, where m is the number of clauses of F, mU is the number of clauses of F containing a variable from U, n' is the total number of variables in clauses not containing a variable in U, and letter is a positive absolute constant. Both U and equation can be found in polynomial time. We use our result to show that the following parameterized problem is fixed-parameter tractable and, moreover, has a kernel with a linear number of variables. In 3-S-MAXSAT-AE, we are given a 3-satisfiable CNF formula F with m clauses and asked to determine whether there is an assignment which satisfies at least 2m/3  k clauses, where k is the parameter.",11,[],7
1112.4918,gr-qc,"In this paper we will investigate how one can create emergent curved spacetimes by locally tuning the coupling constants of condensed matter systems. In the continuum limit we thus obtain continuous effective quantum fields living on curved spacetimes. In particular, using Stingnet condensates we can obtain effective electromagnetism. We will show for example how we obtain quantum electromagnetism (U(1)-Yang-Mills) in a black hole (Schwarzschild) spacetime.",11,['cond-mat'],13
1101.1615,gr-qc,"The asymptotics of some spin foam amplitudes for a quantum 4-simplex is known to display rapid oscillations whose frequency is the Regge action. In this note, we reformulate this result through a difference equation, asymptotically satisfied by these models, and whose semi-classical solutions are precisely the sine and the cosine of the Regge action. This equation is then interpreted as coming from the canonical quantization of a simple constraint in Regge calculus. This suggests to lift and generalize this constraint to the phase space of loop quantum gravity parametrized by twisted geometries. The result is a reformulation of the flat model for topological BF theory from the Hamiltonian perspective. The Wheeler-de-Witt equation in the spin network basis gives difference equations which are exactly recursion relations on the 15j-symbol. Moreover, the semi-classical limit is investigated using coherent states, and produces the expected results. It mimics the classical constraint with quantized areas, and for Regge geometries it reduces to the semi-classical equation which has been introduced in the beginning.",11,['hep-th'],13
1111.5650,gr-qc,"This paper presents an in-depth study of how to estimate the sensitivity of searches for gravitational-wave pulsars -- rapidly-rotating neutron stars which emit quasi-sinusoidal gravitational waves. It is particularly concerned with searches over a wide range of possible source parameters, such as searches over the entire sky and broad frequency bands. Traditional approaches to estimating the sensitivity of such searches use either computationally-expensive Monte Carlo simulations, or analytic methods which sacrifice accuracy by making an unphysical assumption about the population of sources being searched for. This paper develops a new, analytic method of estimating search sensitivity which does not rely upon this unphysical assumption. Unlike previous analytic methods, the new method accurately predicts the sensitivity obtained using Monte Carlo simulations, while avoiding their computational expense. The change in estimated sensitivity due to properties of the search template bank, and the geographic configuration of the gravitational wave detector network, are also investigated.",11,[],13
1105.1334,gr-qc,"We discuss the expansions used in spin foam cosmology. We point out that already at the one vertex level arbitrarily complicated amplitudes contribute, and discuss the geometric asymptotics of the five simplest ones. We discuss what type of consistency conditions would be required to control the expansion. We show that the factorisation of the amplitude originally considered is best interpreted in topological terms. We then consider the next higher term in the graph expansion. We demonstrate the tension between the truncation to small graphs and going to the homogeneous sector, and conclude that it is necessary to truncate the dynamics as well.",11,[],13
1101.0870,gr-qc,"Observational evidence for black hole spin down has been found in the normalized light curves of long GRBs in the BATSE catalogue. Over the duration equation of the burst, matter swept up by the central black hole is susceptible to non-axisymmetries producing gravitational radiation with a negative chirp. A time sliced matched filtering method is introduced to capture phase-coherence on intermediate timescales, equation, here tested by injection of templates into experimental strain noise, equation. For TAMA 300, equation Hzequation at equation kHz gives a sensitivity distance for a reasonably accurate extraction of the trajectory in the time frequency domain of about equation Mpc for spin fown of black holes of mass equation with equation s. Extrapolation to advanced detectors implies equation Mpc for equation Hzequation around 1 kHz, which will open a new window to rigorous calorimetry on Kerr black holes.",11,['astro-ph'],13
1109.6005,gr-qc,"As a prototypical massive field theory we study the scalar field on the recently introduced Finsler spacetimes. We show that particle excitations exist that propagate faster than the speed of light recognized as the boundary velocity of observers. This effect appears already in Finsler spacetime geometries with very small departures from Lorentzian metric geometry. It switches on for a sufficiently large ratio of the particle four-momentum and mass, and is the consequence of a modified version of the Coleman-Glashow velocity dispersion relation. The momentum dispersion relation on Finsler spacetimes is shown to be the same as on metric spacetimes, which differs from many quantum gravity models. If similar relations resulted for fermions on Finsler spacetimes, these generalized geometries could explain the potential observation of superluminal neutrinos claimed by the Opera Collaboration.",11,"['hep-th', 'math-ph', 'math']",13
1110.0611,gr-qc,In these two lectures I describe the difficulties one encounters when trying to construct a framework in which to describe topology change in classical general relativity where one sticks to the assumption of an everywhere non-singular Lorentzian metric and how these difficulties can be circumvented in the Euclidean approach to quantum gravity.,11,['hep-th'],13
1102.4410,gr-qc,"The spherically symmetric static solutions are searched for in some f(T) models of gravity theory with a Maxwell term. To do this, we demonstrate that reconstructing the Lagrangian of f(T) theories is sensitive to the choice of frame, and then we introduce a particular frame based on the conformally Cartesian coordinates. In this particular frame, the existence conditions of various solutions are presented. Our results imply that only a limited class of f(T) models can be solved in this frame. For more general models, the search for spherically symmetric static solutions is still an open and challenging problem, hopefully solvable in other frames.",11,"['astro-ph', 'hep-th']",13
1107.0937,gr-qc,"We consider weighted parallel spinors in Lorentzian Weyl geometry in arbitrary dimensions, choosing the weight such that the integrability condition for the existence of such a spinor, implies the geometry to be Einstein-Weyl. We then use techniques developed for the classification of supersymmetric solutions to supergravity theories to characterise those Lorentzian EW geometries that allow for a weighted parallel spinor, calling the resulting geometries supersymmetric. The overall result is that they are either conformally related to ordinary geometries admitting parallel spinors (w.r.t. the Levi-Civita connection) or are conformally related to certain Kundt spacetimes. A full characterisation is obtained for the 4 and 6 dimensional cases.",11,"['hep-th', 'math']",13
1103.1072,gr-qc,"The canonical decomposition of a Lorentz algebra element into a sum of orthogonal simple (decomposable) Lorentz bivectors is discussed, as well as the decomposition of a proper orthochronous Lorentz transformation into a product of commuting Lorentz transformations, each of which is the exponential of a simple bivector. As an application, we obtain an alternative method of deriving the formulas for the exponential and logarithm for Lorentz transformations.",11,"['math-ph', 'math']",13
1112.3694,gr-qc,"The future detection of gravitational wave forces us to consider the many ways in which astrophysics, gravitational wave theory and fundamental theory will interact. In this paper, I summarize some recent work done to develop such an interface. In particular, I concentrate on how non-vacuum astrophysical environments can modify the gravitational wave signal emitted by compact binary inspirals, and whether signatures from the former are detectable by current and future gravitational wave detectors. I also describe the interface between gravitational wave modeling and fundamental theory, focusing on the status of the parameterized post-Einsteinian framework (a general framework to detect deviations away from General Relativity in future gravitational wave data) and its current data analysis implementation.",11,"['astro-ph', 'hep-ph', 'hep-th']",13
1101.2791,gr-qc,"We compute the corrections to the orbital Lense-Thirring effect (or frame-dragging) in the presence of spacetime torsion. We derive the equations of motion of a test body in the gravitational field of a rotating axisymmetric massive body, using the parametrized framework of Mao, Tegmark, Guth and Cabi. We calculate the secular variations of the longitudes of the node and of the pericenter. We also show how the LAser GEOdynamics Satellites (LAGEOS) can be used to constrain torsion parameters. We report the experimental constraints obtained using both the nodes and perigee measurements of the orbital Lense-Thirring effect. This makes LAGEOS and Gravity Probe B (GPB) complementary frame-dragging and torsion experiments, since they constrain three different combinations of torsion parameters.",11,[],13
1103.4783,gr-qc,"The aims of this letter are two. First, to show the angular gauge-invariance on the response of interferometers to gravitational waves (GWs). In this process, after resuming for completeness results on the Transverse-Traceless (TT) gauge, where, in general, the theoretical computations on GWs are performed, we analyse the gauge of the local observer, which represents the gauge of a laboratory environment on Earth. The gauge-invariance between the two gauges is shown in its full angular and frequency dependences. In previous works in the literature this gauge-invariance was shown only in the low frequencies approximation or in the simplest geometry of the interferometer with respect to the propagating GW (i.e. both of the arms of the interferometer are perpendicular to the propagating GW). Second, as far as the computation of the response functions in the gauge of the local observer is concerned, a common misconception about interferometers is also clarified. Such a misconception purports that, as the wavelength of laser light and the length of an interferometer's arm are both stretched by a GW, no effect should be visible, invoking an analogy with cosmological redshift in an expanding universe.",11,[],13
1111.3021,gr-qc,"We establish the physical process version of first law by studying small perturbations of a stationary black hole with regular bifurcation surface in Einstein-Gauss-Bonnet (EGB) gravity. Our result shows that when the stationary black hole is perturbed by a matter stress energy tensor and finally settles down to a new stationary state, the Wald entropy increases as long as the matter satisfies null energy condition.",11,['hep-th'],13
1105.4184,gr-qc,"It is generally assumed that the gravitational field is bosonic. Here we show that a simple propagating torsional theory can give rise to localized geometric structures that can consistently be quantized as fermions under exchange. To demonstrate this, we show that the model can be formally mapped onto the Skyrme model of baryons, and we use well-known results from Skyrme theory. This begs the question: \it Is geometry bosonic or fermionic (or both)?",11,['hep-th'],13
1112.2785,gr-qc,"In this paper we study the non-Gaussian features of the primordial fluctuations in loop quantum cosmology with the inverse volume corrections. The detailed analysis is performed in the single field slow-roll inflationary models. However, our results reflect the universal characteristics of bispectrum in loop quantum cosmology. The main corrections to the scalar bispectrum come from two aspects: one is the modifications to the standard Bunch-Davies vacuum, the other is the corrections to the background dependent variables, such as slow-roll parameters. Our calculations show that the loop quantum corrections make equation of the inflationary models increase 0.1%. Moreover, we find that two new shapes arise, namely equation and equation. The former gives a unique loop quantum feature which is less correlated with the local, equilateral and single types, while the latter is highly correlated with the local one.",11,"['astro-ph', 'hep-th']",13
1107.2728,gr-qc,"We explore the gravitational collapse of a spherically symmetric dust cloud in the Einstein-Gauss-Bonnet gravity without a cosmological constant, and obtain three families of LTB-like solutions. It is shown that the Gauss-Bonnet term has a profound influence on the nature of singularities, and the global structure of space-time changes drastically from the analogous general relativistic case. Interestingly, the formation of a naked, massive and uncentral singularity, allowed in 5-dimensional space-time, is forbidden if equation. Moreover, such singularity is gravitational strong and a serious counter example to CCH.",11,['hep-th'],13
