id,category,abstract,year,cross_lists,cat_int
1603.06212,cs,"As the field of data science continues to grow, there will be an ever-increasing demand for tools that make machine learning accessible to non-experts. In this paper, we introduce the concept of tree-based pipeline optimization for automating one of the most tedious parts of machine learning---pipeline design. We implement an open source Tree-based Pipeline Optimization Tool (TPOT) in Python and demonstrate its effectiveness on a series of simulated and real-world benchmark data sets. In particular, we show that TPOT can design machine learning pipelines that provide a significant improvement over a basic machine learning analysis while requiring little to no input nor prior knowledge from the user. We also address the tendency for TPOT to design overly complex pipelines by integrating Pareto optimization, which produces compact pipelines without sacrificing classification accuracy. As such, this work represents an important step toward fully automating machine learning pipeline design.",16,[],7
1603.03783,cs,"In this paper, we propose a multi-object detection and tracking method using depth cameras. Depth maps are very noisy and obscure in object detection. We first propose a region-based method to suppress high magnitude noise which cannot be filtered using spatial filters. Second, the proposed method detect Region of Interests by temporal learning which are then tracked using weighted graph-based approach. We demonstrate the performance of the proposed method on standard depth camera datasets with and without object occlusions. Experimental results show that the proposed method is able to suppress high magnitude noise in depth maps and detect/track the objects (with and without occlusion).",16,[],7
1604.06884,cs,"We consider an asynchronous voting process on graphs which we call discordant voting, and which can be described as follows. Initially each vertex holds one of two opinions, red or blue say. Neighbouring vertices with different opinions interact pairwise. After an interaction both vertices have the same colour. The quantity of interest is T, the time to reach consensus , i.e. the number of interactions needed for all vertices have the same colour.   An edge whose endpoint colours differ (i.e. one vertex is coloured red and the other one blue) is said to be discordant. A vertex is discordant if its is incident with a discordant edge. In discordant voting, all interactions are based on discordant edges. Because the voting process is asynchronous there are several ways to update the colours of the interacting vertices. Push: Pick a random discordant vertex and push its colour to a random discordant neighbour. Pull: Pick a random discordant vertex and pull the colour of a random discordant neighbour. Oblivious: Pick a random endpoint of a random discordant edge and push the colour to the other end point.   We show that E(T), the expected time to reach consensus, depends strongly on the underlying graph and the update rule. For connected graphs on n vertices, and an initial half red, half blue colouring the following hold. For oblivious voting, E(T) =n2/4 independent of the underlying graph. For the complete graph Kn, the push protocol has E(T)= Theta(n log(n)), whereas the pull protocol has E(T)= Theta(2n). For the cycle Cn all three protocols have E(T) = Theta(n2). For the star graph however, the pull protocol has E(T)=O(n2), whereas the push protocol is slower with E(T) = Theta(n2 log(n)).   The wide variation in E(T) for the pull protocol is to be contrasted with the well known model of synchronous pull voting, for which E(T) = O(n) on many classes of expanders.",16,[],7
1605.06863,cs,"We target the problem of sparse 3D reconstruction of dynamic objects observed by multiple unsynchronized video cameras with unknown temporal overlap. To this end, we develop a framework to recover the unknown structure without sequencing information across video sequences. Our proposed compressed sensing framework poses the estimation of 3D structure as the problem of dictionary learning, where the dictionary is defined as an aggregation of the temporally varying 3D structures. Given the smooth motion of dynamic objects, we observe any element in the dictionary can be well approximated by a sparse linear combination of other elements in the same dictionary (i. e. self-expression). Moreover, the sparse coefficients describing a locally linear 3D structural interpolation reveal the local sequencing information. Our formulation optimizes a biconvex cost function that leverages a compressed sensing formulation and enforces both structural dependency coherence across video streams, as well as motion smoothness across estimates from common video sources. We further analyze the reconstructability of our approach under different capture scenarios, and its comparison and relation to existing methods. Experimental results on large amounts of synthetic data as well as real imagery demonstrate the effectiveness of our approach.",16,[],7
1604.02935,cs,"Interactive visual analytic systems enable users to discover insights from complex data. Users can express and test hypotheses via user interaction, leveraging their domain expertise and prior knowledge to guide and steer the analytic models in the system. For example, semantic interaction techniques enable systems to learn from the user's interactions and steer the underlying analytic models based on the user's analytical reasoning. However, an open challenge is how to not only steer models based on the dimensions or features of the data, but how to add dimensions or attributes to the data based on the domain expertise of the user. In this paper, we present a technique for inferring and appending dimensions onto the dataset based on the prior expertise of the user expressed via user interactions. Our technique enables users to directly manipulate a spatial organization of data, from which both the dimensions of the data are weighted, and also dimensions created to represent the prior knowledge the user brings to the system. We describe this technique and demonstrate its utility via a use case.",16,[],7
1608.01946,cs,"In recent years, several frameworks and systems have been proposed that extend Inductive Logic Programming (ILP) to the Answer Set Programming (ASP) paradigm. In ILP, examples must all be explained by a hypothesis together with a given background knowledge. In existing systems, the background knowledge is the same for all examples; however, examples may be context-dependent. This means that some examples should be explained in the context of some information, whereas others should be explained in different contexts. In this paper, we capture this notion and present a context-dependent extension of the Learning from Ordered Answer Sets framework. In this extension, contexts can be used to further structure the background knowledge. We then propose a new iterative algorithm, ILASP2i, which exploits this feature to scale up the existing ILASP2 system to learning tasks with large numbers of examples. We demonstrate the gain in scalability by applying both algorithms to various learning tasks. Our results show that, compared to ILASP2, the newly proposed ILASP2i system can be two orders of magnitude faster and use two orders of magnitude less memory, whilst preserving the same average accuracy. This paper is under consideration for acceptance in TPLP.",16,[],7
1610.03450,cs,"This work introduces a novel, modular, layered web based platform for managing machine learning experiments on grid-based High Performance Computing infrastructures. The coupling of the communication services offered by the grid, with an administration layer and conventional web server programming, via a data synchronization utility, leads to the straightforward development of a web-based user interface that allows the monitoring and managing of diverse online distributed computing applications. It also introduces an experiment generation and monitoring tool particularly suitable for investigating machine learning in game playing. The platform is demonstrated with experiments for two different games.",16,[],7
1602.04376,cs,"Change management for evolving collaborative business process development is crucial when the business logic, transections and workflow change due to changes in business strategies or organizational and technical environment. During the change implementation, business processes are analyzed and improved ensuring that they capture the proposed change and they do not contain any undesired functionalities or change side-effects. This paper presents Business Process Change Management approach for the efficient and effective implementation of change in the business process. The key technology behind our approach is our proposed Business Process Change Management Ontology (BPCMont) which is the main contribution of this paper. BPCMont, as a formalized change specification, helps to revert BP into a consistent state in case of system crash, intermediate conflicting stage or unauthorized change done, aid in change traceability in the new and old versions of business processes, change effects can be seen and estimated effectively, ease for Stakeholders to validate and verify change implementation, etc.",16,[],7
1609.05930,cs,"Studying information diffusion and the spread of goods in the real world and in many digital services can be extremely difficult since information about the information flows is challenging to accurately track. How information spreads has commonly been analysed from the perspective of homophily, social influence, and initial seed selection. However, in virtual worlds and virtual economies, the movements of information and goods can be precisely tracked. Therefore, these environments create laboratories for the accurate study of information diffusion characteristics that have been difficult to study in prior research. In this paper, we study how content visibility as well as sender and receiver characteristics, the relationship between them, and the types of multilayer social network layers affect content absorption and diffusion in virtual world. The results show that prior visibility of distributed content is the strongest predictor of content adoption and its further spread across networks. Among other analysed factors, the mechanics of diffusion, content quality, and content adoption by users neighbours on the social activity layer had very strong influences on the adoption of new content.",16,[],7
1608.05045,cs,"In this paper, we present a solution for arbitrary 3D character deformation by investigating rotation angle of decomposition and preserving the mesh topology structure. In computer graphics, skeleton extraction and skeleton-driven animation is an active areas and gains increasing interests from researchers. The accuracy is critical for realistic animation and related applications. There have been extensive studies on skeleton based 3D deformation. However for the scenarios of large angle rotation of different body parts, it has been relatively less addressed by the state-of-the-art, which often yield unsatisfactory results. Besides 3D animation problems, we also notice for many 3D skeleton detection or tracking applications from a video or depth streams, large angle rotation is also a critical factor in the regression accuracy and robustness. We introduced a distortion metric function to quantify the surface curviness before and after deformation, which is a major clue for large angle rotation detection. The intensive experimental results show that our method is suitable for 3D modeling, animation, skeleton based tracking applications.",16,[],7
1602.05996,cs,"Restricted Boltzmann Machines and Deep Belief Networks have been successfully used in probabilistic generative model applications such as image occlusion removal, pattern completion and motion synthesis. Generative inference in such algorithms can be performed very efficiently on hardware using a Markov Chain Monte Carlo procedure called Gibbs sampling, where stochastic samples are drawn from noisy integrate and fire neurons implemented on neuromorphic substrates. Currently, no satisfactory metrics exist for evaluating the generative performance of such algorithms implemented on high-dimensional data for neuromorphic platforms. This paper demonstrates the application of nonparametric goodness-of-fit testing to both quantify the generative performance as well as provide decision-directed criteria for choosing the parameters of the neuromorphic Gibbs sampler and optimizing usage of hardware resources used during sampling.",16,[],7
1607.01577,cs,"In this paper, we propose a compact network called CUNet (compact unsupervised network) to counter the image classification challenge. Different from the traditional convolutional neural networks learning filters by the time-consuming stochastic gradient descent, CUNet learns the filter bank from diverse image patches with the simple K-means, which significantly avoids the requirement of scarce labeled training images, reduces the training consumption, and maintains the high discriminative ability. Besides, we propose a new pooling method named weighted pooling considering the different weight values of adjacent neurons, which helps to improve the robustness to small image distortions. In the output layer, CUNet integrates the feature maps gained in the last hidden layer, and straightforwardly computes histograms in non-overlapped blocks. To reduce feature redundancy, we implement the max-pooling operation on adjacent blocks to select the most competitive features. Comprehensive experiments are conducted to demonstrate the state-of-the-art classification performances with CUNet on CIFAR-10, STL-10, MNIST and Caltech101 benchmark datasets.",16,[],7
1609.07495,cs,"We tackle the problem of learning a rotation invariant latent factor model when the training data is comprised of lower-dimensional projections of the original feature space. The main goal is the discovery of a set of 3-D bases poses that can characterize the manifold of primitive human motions, or movemes, from a training set of 2-D projected poses obtained from still images taken at various camera angles. The proposed technique for basis discovery is data-driven rather than hand-designed. The learned representation is rotation invariant, and can reconstruct any training instance from multiple viewing angles. We apply our method to modeling human poses in sports (via the Leeds Sports Dataset), and demonstrate the effectiveness of the learned bases in a range of applications such as activity classification, inference of dynamics from a single frame, and synthetic representation of movements.",16,[],7
1603.00370,cs,"We are interested in the large-scale learning of Mahalanobis distances, with a particular focus on person re-identification.   We propose a metric learning formulation called Weighted Approximate Rank Component Analysis (WARCA). WARCA optimizes the precision at top ranks by combining the WARP loss with a regularizer that favors orthonormal linear mappings, and avoids rank-deficient embeddings. Using this new regularizer allows us to adapt the large-scale WSABIE procedure and to leverage the Adam stochastic optimization algorithm, which results in an algorithm that scales gracefully to very large data-sets. Also, we derive a kernelized version which allows to take advantage of state-of-the-art features for re-identification when data-set size permits kernel computation.   Benchmarks on recent and standard re-identification data-sets show that our method beats existing state-of-the-art techniques both in term of accuracy and speed. We also provide experimental analysis to shade lights on the properties of the regularizer we use, and how it improves performance.",16,[],7
1607.05427,cs,"Human faces in surveillance videos often suffer from severe image blur, dramatic pose variations, and occlusion. In this paper, we propose a comprehensive framework based on Convolutional Neural Networks (CNN) to overcome challenges in video-based face recognition (VFR). First, to learn blur-robust face representations, we artificially blur training data composed of clear still images to account for a shortfall in real-world video training data. Using training data composed of both still images and artificially blurred data, CNN is encouraged to learn blur-insensitive features automatically. Second, to enhance robustness of CNN features to pose variations and occlusion, we propose a Trunk-Branch Ensemble CNN model (TBE-CNN), which extracts complementary information from holistic face images and patches cropped around facial components. TBE-CNN is an end-to-end model that extracts features efficiently by sharing the low- and middle-level convolutional layers between the trunk and branch networks. Third, to further promote the discriminative power of the representations learnt by TBE-CNN, we propose an improved triplet loss function. Systematic experiments justify the effectiveness of the proposed techniques. Most impressively, TBE-CNN achieves state-of-the-art performance on three popular video face databases: PaSC, COX Face, and YouTube Faces. With the proposed techniques, we also obtain the first place in the BTAS 2016 Video Person Recognition Evaluation.",16,[],7
1604.05459,cs,"In this article, a novel neuro-inspired low-resolution online unsupervised learning rule is proposed to train the reservoir or liquid of Liquid State Machine. The liquid is a sparsely interconnected huge recurrent network of spiking neurons. The proposed learning rule is inspired from structural plasticity and trains the liquid through formation and elimination of synaptic connections. Hence, the learning involves rewiring of the reservoir connections similar to structural plasticity observed in biological neural networks. The network connections can be stored as a connection matrix and updated in memory by using Address Event Representation (AER) protocols which are generally employed in neuromorphic systems. On investigating the 'pairwise separation property' we find that trained liquids provide 1.36 equation 0.18 times more inter-class separation while retaining similar intra-class separation as compared to random liquids. Moreover, analysis of the 'linear separation property' reveals that trained liquids are 2.05 equation 0.27 times better than random liquids. Furthermore, we show that our liquids are able to retain the 'generalization' ability and 'generality' of random liquids. A memory analysis shows that trained liquids have 83.67 equation 5.79 ms longer fading memory than random liquids which have shown 92.8 equation 5.03 ms fading memory for a particular type of spike train inputs. We also throw some light on the dynamics of the evolution of recurrent connections within the liquid. Moreover, compared to 'Separation Driven Synaptic Modification' - a recently proposed algorithm for iteratively refining reservoirs, our learning rule provides 9.30%, 15.21% and 12.52% more liquid separations and 2.8%, 9.1% and 7.9% better classification accuracies for four, eight and twelve class pattern recognition tasks respectively.",16,[],7
1605.02045,cs,"Semi-labeled trees are phylogenies whose internal nodes may be labeled by higher-order taxa. Thus, a leaf labeled Mus musculus could nest within a subtree whose root node is labeled Rodentia, which itself could nest within a subtree whose root is labeled Mammalia. Suppose we are given collection equation of semi-labeled trees over various subsets of a set of taxa. The ancestral compatibility problem asks whether there is a semi-labeled tree equation that respects the clusterings and the ancestor/descendant relationships implied by the trees in equation. We give a equation algorithm for the ancestral compatibility problem, where equation is the total number of nodes and edges in the trees in equation. Unlike the best previous algorithm, the running time of our method does not depend on the degrees of the nodes in the input trees.",16,[],7
1602.02434,cs,"Sparse decomposition has been widely used for different applications, such as source separation, image classification, image denoising and more. This paper presents a new algorithm for segmentation of an image into background and foreground text and graphics using sparse decomposition and total variation minimization. The proposed method is designed based on the assumption that the background part of the image is smoothly varying and can be represented by a linear combination of a few smoothly varying basis functions, while the foreground text and graphics can be modeled with a sparse component overlaid on the smooth background. The background and foreground are separated using a sparse decomposition framework regularized with a few suitable regularization terms which promotes the sparsity and connectivity of foreground pixels. This algorithm has been tested on a dataset of images extracted from HEVC standard test sequences for screen content coding, and is shown to have superior performance over some prior methods, including least absolute deviation fitting, k-means clustering based segmentation in DjVu and shape primitive extraction and coding (SPEC) algorithm.",16,[],7
1602.07646,cs,"Incompleteness theorems of Godel, Turing, Chaitin, and Algorithmic Information Theory have profound epistemological implications. Incompleteness limits our ability to ever understand every observable phenomenon in the universe. Incompleteness limits the ability of evolutionary processes from finding optimal solutions. Incompleteness limits the detectability of machine consciousness. This is an effort to convey these thoughts and results in a somewhat entertaining manner.",16,[],7
1609.02258,cs,"Generalized matrix approximation plays a fundamental role in many machine learning problems, such as CUR decomposition, kernel approximation, and matrix low rank approximation. Especially with today's applications involved in larger and larger dataset, more and more efficient generalized matrix approximation algorithems become a crucially important research issue. In this paper, we find new sketching techniques to reduce the size of the original data matrix to develop new matrix approximation algorithms. Our results derive a much tighter bound for the approximation than previous works: we obtain a equation approximation ratio with small sketched dimensions which implies a more efficient generalized matrix approximation.",16,[],7
1608.05380,cs,"Traditional Recommender Systems (RS) do not consider any personal user information beyond rating history. Such information, on the other hand, is widely available on social networking sites (Facebook, Twitter). As a result, social networks have recently been used in recommendation systems. In this paper, we propose an efficient method for incorporating social signals into the recommendation process by building a trust network which supplements the users' rating profiles. We first show the effect of different cold-start users types on the Collaborative Filtering (CF) technique in several real-world datasets. Later, we propose a ""Trust-Aware Neighbourhood"" algorithm which addresses a performance issue of the former by limiting the trusted neighbourhood. We show the doubling of the rating coverage compared to the traditional CF technique, and a significant improvement in the accuracy for some datasets. Focusing specifically on cold-start users, we propose a ""Hybrid Trust-Aware Neighbourhood"" algorithm which expands the neighbourhood by considering both trust and rating history of the users. We show a near complete coverage with a rich trust network dataset-- Flixster. We conclude by discussing the potential implementation of this algorithm in a budget-constrained cloud environment.",16,[],7
1606.00232,cs,"Social media based indicators or altmetrics have been under scrutiny for the last seven years. Their promise as alternative metrics for measuring scholarly impact is still far from becoming a reality. Up to now, most studies have focused on the understanding of the nature and relation of altmetric indicators with citation data. Few papers have analysed research profiles based on altmetric data. Most of these have related to researcher profiles and the expansion of these tools among researchers. This paper aims at exploring the coverage of the Altmetric.com database and its potential use in order to show universities' research profiles in relationship with other databases. We analyse a sample of four different Spanish universities.First, we observe a low coverage of altmetric indicators with only 36 percent of all documents retrieved from the Web of Science having an 'altmetric' score. Second, we observe that for the four universities analysed, the area of Science shows higher 'altmetric' scores that the rest of the research areas. Finally, considering the low coverage of altmetric data at the institutional level, it could be interesting for research policy makers to consider the development of guidelines and best practices guides to ensure that researchers disseminate adequately their research findings through social media.",16,[],7
